id	description	number_of_orders	price	url
4000844237350	Разблокированный Оригинальный сотовый телефон BlackBerry Keyone, восемь ядер, 12 МП, 4,5 дюйма, 3G B, 4 Гб ОЗУ 32 Гб 64 Гб ПЗУ, 3G 4G LTE, Восстановленный, бесплат...		20 772,77 - 23 419,18 руб.	//aliexpress.ru/item/4000844237350.html?algo_pvid=239defae-f7a0-41d5-bbbe-a58f77bafccd&algo_expid=239defae-f7a0-41d5-bbbe-a58f77bafccd-31&btsid=0b0a182b16006803054633248e5846&ws_ab_test=searchweb0_0,searchweb201602_,searchweb201603_
33008020728	Мобильный телефон Motorola Razr V3, 100% оригинал, глобальная версия, GSM, четыре диапазона, один год гарантии, бесплатная доставка	44 продано	3 329,03 - 4 784,56 руб.	//aliexpress.ru/item/33008020728.html?algo_pvid=239defae-f7a0-41d5-bbbe-a58f77bafccd&algo_expid=239defae-f7a0-41d5-bbbe-a58f77bafccd-32&btsid=0b0a182b16006803054633248e5846&ws_ab_test=searchweb0_0,searchweb201602_,searchweb201603_
691766656	Оригинальный мобильный телефон Sony Ericsson U1i Satio, разблокированный, 3G, 12 МП, Wi-Fi, GPS, сенсорный экран, 0 месяцев гарантии	5 продано	5 136,38 - 5 836,90 руб.	//aliexpress.ru/item/691766656.html?algo_pvid=239defae-f7a0-41d5-bbbe-a58f77bafccd&algo_expid=239defae-f7a0-41d5-bbbe-a58f77bafccd-33&btsid=0b0a182b16006803054633248e5846&ws_ab_test=searchweb0_0,searchweb201602_,searchweb201603_
1712034283	Оригинальный телефон NOKIA 6700, мобильный телефон 3G GSM, разблокированный, 6700 s, телефон с синей и английской клавиатурой	7 продано	2 066,54 - 2 583,37 руб.	//aliexpress.ru/item/1712034283.html?algo_pvid=239defae-f7a0-41d5-bbbe-a58f77bafccd&algo_expid=239defae-f7a0-41d5-bbbe-a58f77bafccd-34&btsid=0b0a182b16006803054633248e5846&ws_ab_test=searchweb0_0,searchweb201602_,searchweb201603_
4000045921027	Классический барный телефон Nokia 6670 мобильный телефон трехдиапазонный разблокированный оригинальный Восстановленный черный подарок		2 139,71 - 2 560,02 руб.	//aliexpress.ru/item/4000045921027.html?algo_pvid=239defae-f7a0-41d5-bbbe-a58f77bafccd&algo_expid=239defae-f7a0-41d5-bbbe-a58f77bafccd-35&btsid=0b0a182b16006803054633248e5846&ws_ab_test=searchweb0_0,searchweb201602_,searchweb201603_
684129732	Оригинальный мобильный телефон U10i Sony Ericsson Aino U10, 3G, 8,1 МП, Wi-Fi, разблокированный, восстановленная Русская клавиатура	7 продано	2 956,98 - 3 430,22 руб.	//aliexpress.ru/item/684129732.html?algo_pvid=239defae-f7a0-41d5-bbbe-a58f77bafccd&algo_expid=239defae-f7a0-41d5-bbbe-a58f77bafccd-36&btsid=0b0a182b16006803054633248e5846&ws_ab_test=searchweb0_0,searchweb201602_,searchweb201603_
1005001444817643	Оригинальный HTC One E9 Plus 5,5 дюймов 32 Гб ROM 3 Гб RAM Octa core MTK 20.0MP LTE две sim-карты разблокированный сенсорный экран для телефона		4 972,92 руб.	//aliexpress.ru/item/1005001444817643.html?algo_pvid=239defae-f7a0-41d5-bbbe-a58f77bafccd&algo_expid=239defae-f7a0-41d5-bbbe-a58f77bafccd-37&btsid=0b0a182b16006803054633248e5846&ws_ab_test=searchweb0_0,searchweb201602_,searchweb201603_
32432645973	6131 разблокированный Оригинальный разблокированный Nokia 6131 русская клавиатура Bluetooth дешевый мобильный телефон		2 217,54 - 2 365,43 руб.	//aliexpress.ru/item/32432645973.html?algo_pvid=239defae-f7a0-41d5-bbbe-a58f77bafccd&algo_expid=239defae-f7a0-41d5-bbbe-a58f77bafccd-38&btsid=0b0a182b16006803054633248e5846&ws_ab_test=searchweb0_0,searchweb201602_,searchweb201603_
4000420312581	Nokia Lumia 535, оригинальный 5-дюймовый 5-мегапиксельный четырехъядерный процессор, 8 Гб ПЗУ, 1 ГБ ОЗУ, разблокированный сенсорный экран, бесплатная...	4 продано	3 330,59 - 3 473,03 руб.	//aliexpress.ru/item/4000420312581.html?algo_pvid=239defae-f7a0-41d5-bbbe-a58f77bafccd&algo_expid=239defae-f7a0-41d5-bbbe-a58f77bafccd-39&btsid=0b0a182b16006803054633248e5846&ws_ab_test=searchweb0_0,searchweb201602_,searchweb201603_
32919454345	Samsung Galaxy J2 Prime G532F смартфон с 5-дюймовым дисплеем, четырёхъядерным процессором, ОЗУ 1,5 ГБ, ПЗУ 8 ГБ, 8 МП		11 332,09 - 11 954,77 руб.	//aliexpress.ru/item/32919454345.html?algo_pvid=239defae-f7a0-41d5-bbbe-a58f77bafccd&algo_expid=239defae-f7a0-41d5-bbbe-a58f77bafccd-40&btsid=0b0a182b16006803054633248e5846&ws_ab_test=searchweb0_0,searchweb201602_,searchweb201603_
33001895393	Оригинальный разблокированный Samsung Galaxy Grand I9082, мобильный телефон 8 Мп, двухъядерный, 1 ГБ ОЗУ 8 Гб ПЗУ, Восстановленный сотовый телефон Android, ...		4 358,02 - 4 980,71 руб.	//aliexpress.ru/item/33001895393.html?algo_pvid=239defae-f7a0-41d5-bbbe-a58f77bafccd&algo_expid=239defae-f7a0-41d5-bbbe-a58f77bafccd-41&btsid=0b0a182b16006803054633248e5846&ws_ab_test=searchweb0_0,searchweb201602_,searchweb201603_
4000062466922	Разблокированный телефон Motorola ROKR E6, 100% оригинал, 2,4 дюйма, 2 Мп, GSM 2G, мобильный телефон, бесплатная доставка	4 продано	3 865,32 - 4 724,63 руб.	//aliexpress.ru/item/4000062466922.html?algo_pvid=239defae-f7a0-41d5-bbbe-a58f77bafccd&algo_expid=239defae-f7a0-41d5-bbbe-a58f77bafccd-42&btsid=0b0a182b16006803054633248e5846&ws_ab_test=searchweb0_0,searchweb201602_,searchweb201603_
33011650650	Мобильный телефон Sony Ericsson W350, 100% оригинал, 2G, Bluetooth, 1,3-мегапиксельная камера, FM, разблокированный сотовый телефон, бесплатная доставка	5 продано	3 845,86 - 4 079,37 руб.	//aliexpress.ru/item/33011650650.html?algo_pvid=239defae-f7a0-41d5-bbbe-a58f77bafccd&algo_expid=239defae-f7a0-41d5-bbbe-a58f77bafccd-43&btsid=0b0a182b16006803054633248e5846&ws_ab_test=searchweb0_0,searchweb201602_,searchweb201603_
32839375281	Разблокированные оригинальные мобильные телефоны HTC ONE M7 2 Гб ОЗУ 32 Гб ПЗУ смартфон 4,7 дюймов экран Android 5,0 четырехъядерный сенсорный экран HTC ...		4 660,80 - 5 672,66 руб.	//aliexpress.ru/item/32839375281.html?algo_pvid=239defae-f7a0-41d5-bbbe-a58f77bafccd&algo_expid=239defae-f7a0-41d5-bbbe-a58f77bafccd-44&btsid=0b0a182b16006803054633248e5846&ws_ab_test=searchweb0_0,searchweb201602_,searchweb201603_
32241560064	Оригинал Восстановленное Nokia 6303 Classic 3MP мобильного телефона 6303c телефона русский иврит арабский клавиатура	16 продано	1 869,62 - 2 423,81 руб.	//aliexpress.ru/item/32241560064.html?algo_pvid=239defae-f7a0-41d5-bbbe-a58f77bafccd&algo_expid=239defae-f7a0-41d5-bbbe-a58f77bafccd-45&btsid=0b0a182b16006803054633248e5846&ws_ab_test=searchweb0_0,searchweb201602_,searchweb201603_
675220996	Восстановленный Оригинальный мобильный телефон Nokia 6555, 3G разблокированный MP3 Bluetooth Русская арабская клавиатура	7 продано	3 035,59 - 3 100,20 руб.	//aliexpress.ru/item/675220996.html?algo_pvid=239defae-f7a0-41d5-bbbe-a58f77bafccd&algo_expid=239defae-f7a0-41d5-bbbe-a58f77bafccd-46&btsid=0b0a182b16006803054633248e5846&ws_ab_test=searchweb0_0,searchweb201602_,searchweb201603_
737233344	Оригинальные Сотовые телефоны Sony Ericsson w880 w880i, разблокированный мобильный телефон w880, 3G Bluetooth MP3-плеер и один год гарантии	12 продано	2 447,16 - 2 910,28 руб.	//aliexpress.ru/item/737233344.html?algo_pvid=239defae-f7a0-41d5-bbbe-a58f77bafccd&algo_expid=239defae-f7a0-41d5-bbbe-a58f77bafccd-47&btsid=0b0a182b16006803054633248e5846&ws_ab_test=searchweb0_0,searchweb201602_,searchweb201603_
32217423779	Оригинальный мобильный телефон Nokia C5-03, 3G, Wi-Fi, GPS, 5 Мп, разблокированный, смартфон с возможностью подключения к мобильному телефону		5 603,39 - 6 148,24 руб.	//aliexpress.ru/item/32217423779.html?algo_pvid=239defae-f7a0-41d5-bbbe-a58f77bafccd&algo_expid=239defae-f7a0-41d5-bbbe-a58f77bafccd-48&btsid=0b0a182b16006803054633248e5846&ws_ab_test=searchweb0_0,searchweb201602_,searchweb201603_
1005001338808504	Оригинальный разблокирована Nokia Lumia 630 сотовый телефон и высокопроизводительной ОС Windows одной sim карты 8 Гб внутренней памяти 5.0MP камера 4,5 IPS э...		3 023,14 - 3 486,26 руб.	//aliexpress.ru/item/1005001338808504.html?algo_pvid=239defae-f7a0-41d5-bbbe-a58f77bafccd&algo_expid=239defae-f7a0-41d5-bbbe-a58f77bafccd-49&btsid=0b0a182b16006803054633248e5846&ws_ab_test=searchweb0_0,searchweb201602_,searchweb201603_
32984047588	HTC Desire 728 D728w смартфон с 5,5-дюймовым дисплеем, восьмиядерным процессором, ОЗУ 2 Гб, ПЗУ 16 ГБ, 13 МП, LTE		3 863,76 руб.	//aliexpress.ru/item/32984047588.html?algo_pvid=239defae-f7a0-41d5-bbbe-a58f77bafccd&algo_expid=239defae-f7a0-41d5-bbbe-a58f77bafccd-50&btsid=0b0a182b16006803054633248e5846&ws_ab_test=searchweb0_0,searchweb201602_,searchweb201603_
32696792057	S7500 Оригинальный разблокированный смартфон Samsung Galaxy Ace Plus S7500, 5 Мп, 512 МБ ОЗУ + 2 Гб ПЗУ, 3,65 дюйма, Android OS, GPS, WIFI, бесплатная доставка		5 167,51 - 5 790,20 руб.	//aliexpress.ru/item/32696792057.html?algo_pvid=239defae-f7a0-41d5-bbbe-a58f77bafccd&algo_expid=239defae-f7a0-41d5-bbbe-a58f77bafccd-51&btsid=0b0a182b16006803054633248e5846&ws_ab_test=searchweb0_0,searchweb201602_,searchweb201603_
32422459707	Оригинальный смартфон Samsung Galaxy Grand Duos I9082, разблокированный, GPS, 8 Гб ПЗУ, 8 Мп, 5,0 дюйма, две SIM-карты, сенсорный экран, бесплатная доставка	5 продано	3 775,03 - 4 027,22 руб.	//aliexpress.ru/item/32422459707.html?algo_pvid=239defae-f7a0-41d5-bbbe-a58f77bafccd&algo_expid=239defae-f7a0-41d5-bbbe-a58f77bafccd-52&btsid=0b0a182b16006803054633248e5846&ws_ab_test=searchweb0_0,searchweb201602_,searchweb201603_
32837705885	Разблокированный оригинальный мобильный телефон Nokia N80, 2G, разблокированный, один год гарантии, Восстановленный	4 продано	4 681,04 руб.	//aliexpress.ru/item/32837705885.html?algo_pvid=239defae-f7a0-41d5-bbbe-a58f77bafccd&algo_expid=239defae-f7a0-41d5-bbbe-a58f77bafccd-53&btsid=0b0a182b16006803054633248e5846&ws_ab_test=searchweb0_0,searchweb201602_,searchweb201603_
4000118777965	B310E 100% Оригинальный разблокированный сотовый телефон Samsung Guru Music 2, две sim-карты, мобильный телефон с английской и русской клавиатурой, беспла...	8 продано	3 276,11 - 3 768,80 руб.	//aliexpress.ru/item/4000118777965.html?algo_pvid=239defae-f7a0-41d5-bbbe-a58f77bafccd&algo_expid=239defae-f7a0-41d5-bbbe-a58f77bafccd-54&btsid=0b0a182b16006803054633248e5846&ws_ab_test=searchweb0_0,searchweb201602_,searchweb201603_
32695428332	"100% Оригинал Blackberry Z10 двухъядерный 4,2 ""сенсорный экран 2 Гб ОЗУ 16 Гб ПЗУ 8МП камера os STL1003 STL1004 мобильный телефон отремонтирован"	1 продано	3 807,72 - 4 378,26 руб.	//aliexpress.ru/item/32695428332.html?algo_pvid=239defae-f7a0-41d5-bbbe-a58f77bafccd&algo_expid=239defae-f7a0-41d5-bbbe-a58f77bafccd-55&btsid=0b0a182b16006803054633248e5846&ws_ab_test=searchweb0_0,searchweb201602_,searchweb201603_
4000336452204	Оригинальный разблокированный сотовый телефон Nokia 2720, складные сотовые телефоны Nokia 2720, бесплатная доставка	5 продано	2 857,35 - 3 186,59 руб.	//aliexpress.ru/item/4000336452204.html?algo_pvid=239defae-f7a0-41d5-bbbe-a58f77bafccd&algo_expid=239defae-f7a0-41d5-bbbe-a58f77bafccd-56&btsid=0b0a182b16006803054633248e5846&ws_ab_test=searchweb0_0,searchweb201602_,searchweb201603_
674702869	Оригинальный мобильный телефон NOKIA 6555, 3G GSM разблокирован, русская клавиатура, один год гарантии	5 продано	3 423,99 - 4 046,68 руб.	//aliexpress.ru/item/674702869.html?algo_pvid=239defae-f7a0-41d5-bbbe-a58f77bafccd&algo_expid=239defae-f7a0-41d5-bbbe-a58f77bafccd-57&btsid=0b0a182b16006803054633248e5846&ws_ab_test=searchweb0_0,searchweb201602_,searchweb201603_
4000138489217	Оригинальный сотовый телефон LG G6 H871 H872 H873 G600, 4G LTE, 4 Гб ОЗУ 32 Гб ПЗУ, Snapdragon 821, 5,7 дюйма, 13 МП	8 продано	7 426,30 - 8 108,92 руб.	//aliexpress.ru/item/4000138489217.html?algo_pvid=239defae-f7a0-41d5-bbbe-a58f77bafccd&algo_expid=239defae-f7a0-41d5-bbbe-a58f77bafccd-58&btsid=0b0a182b16006803054633248e5846&ws_ab_test=searchweb0_0,searchweb201602_,searchweb201603_
723913750	Оригинальный сотовый телефон Nokia 6600f, 6600 складной, 2G, 3G, разблокированный сотовый телефон		3 890,23 руб.	//aliexpress.ru/item/723913750.html?algo_pvid=239defae-f7a0-41d5-bbbe-a58f77bafccd&algo_expid=239defae-f7a0-41d5-bbbe-a58f77bafccd-59&btsid=0b0a182b16006803054633248e5846&ws_ab_test=searchweb0_0,searchweb201602_,searchweb201603_
4000138489217	Оригинальный сотовый телефон LG G6 H871 H872 H873 G600, 4G LTE, 4 Гб ОЗУ 32 Гб ПЗУ, Snapdragon 821, 5,7 дюйма, 13 МП	8 продано	7 426,30 - 8 108,92 руб.	//aliexpress.ru/item/4000138489217.html?algo_pvid=1e4b98ce-bed6-44ed-8ca1-4ea7fa6b23d6&algo_expid=1e4b98ce-bed6-44ed-8ca1-4ea7fa6b23d6-0&btsid=0b0a182b16006803464174701e5846&ws_ab_test=searchweb0_0,searchweb201602_,searchweb201603_
32690317593	Разблокированный Мобильный телефон Nokia Lumia 830, сенсорный экран 5 дюймов, 16 Гб ПЗУ, четырёхъядерный, 10 МП, Wi-Fi, GPS сотовый телефон		7 354,69 - 7 977,38 руб.	//aliexpress.ru/item/32690317593.html?algo_pvid=1e4b98ce-bed6-44ed-8ca1-4ea7fa6b23d6&algo_expid=1e4b98ce-bed6-44ed-8ca1-4ea7fa6b23d6-1&btsid=0b0a182b16006803464174701e5846&ws_ab_test=searchweb0_0,searchweb201602_,searchweb201603_
4000109654327	Оригинальный разблокированный сотовый телефон Nokia Lumia 735, четыре ядра, 4,7 дюйма, 1 ГБ ОЗУ 8 Гб ПЗУ, LTE, 4G, камера 6,7 МП, телефон Microsoft Windows		4 269,29 - 5 737,27 руб.	//aliexpress.ru/item/4000109654327.html?algo_pvid=1e4b98ce-bed6-44ed-8ca1-4ea7fa6b23d6&algo_expid=1e4b98ce-bed6-44ed-8ca1-4ea7fa6b23d6-2&btsid=0b0a182b16006803464174701e5846&ws_ab_test=searchweb0_0,searchweb201602_,searchweb201603_
32682322955	Оригинальный смартфон Blackberry 9720, разблокированный сотовый телефон с сенсорным экраном 2,8 дюйма, 5 МП, GPS, WiFi, емкостный экран		3 805,39 руб.	//aliexpress.ru/item/32682322955.html?algo_pvid=1e4b98ce-bed6-44ed-8ca1-4ea7fa6b23d6&algo_expid=1e4b98ce-bed6-44ed-8ca1-4ea7fa6b23d6-3&btsid=0b0a182b16006803464174701e5846&ws_ab_test=searchweb0_0,searchweb201602_,searchweb201603_
32848298729	Оригинальный разблокированный Nokia 7260, одноядерный fm-радиоприемник 760 мАч, только старый недорогой Восстановленный мобильный телефон серебр...	2 продано	2 326,51 - 2 560,02 руб.	//aliexpress.ru/item/32848298729.html?algo_pvid=1e4b98ce-bed6-44ed-8ca1-4ea7fa6b23d6&algo_expid=1e4b98ce-bed6-44ed-8ca1-4ea7fa6b23d6-4&btsid=0b0a182b16006803464174701e5846&ws_ab_test=searchweb0_0,searchweb201602_,searchweb201603_
4000118777965	B310E 100% Оригинальный разблокированный сотовый телефон Samsung Guru Music 2, две sim-карты, мобильный телефон с английской и русской клавиатурой, беспла...	8 продано	3 276,11 - 3 768,80 руб.	//aliexpress.ru/item/4000118777965.html?algo_pvid=1e4b98ce-bed6-44ed-8ca1-4ea7fa6b23d6&algo_expid=1e4b98ce-bed6-44ed-8ca1-4ea7fa6b23d6-5&btsid=0b0a182b16006803464174701e5846&ws_ab_test=searchweb0_0,searchweb201602_,searchweb201603_
32847203390	Мобильный телефон Nokia 1202, Восстановленный Оригинальный, разблокированный, один год гарантии	2 продано	1 889,08 - 2 184,85 руб.	//aliexpress.ru/item/32847203390.html?algo_pvid=1e4b98ce-bed6-44ed-8ca1-4ea7fa6b23d6&algo_expid=1e4b98ce-bed6-44ed-8ca1-4ea7fa6b23d6-6&btsid=0b0a182b16006803464174701e5846&ws_ab_test=searchweb0_0,searchweb201602_,searchweb201603_
4000844642495	Оригинальный смартфон Blackberry 9790, разблокированный QWERTY, клавиатура 5 МП, камера 768 Мб ОЗУ 8 Гб ПЗУ, 3G WCDMA, Wi-Fi, GPS, сенсорный экран, 9790		3 570,32 - 4 115,17 руб.	//aliexpress.ru/item/4000844642495.html?algo_pvid=1e4b98ce-bed6-44ed-8ca1-4ea7fa6b23d6&algo_expid=1e4b98ce-bed6-44ed-8ca1-4ea7fa6b23d6-7&btsid=0b0a182b16006803464174701e5846&ws_ab_test=searchweb0_0,searchweb201602_,searchweb201603_
33035927503	Оригинальный разблокированный мобильный телефон Nokia C2, мобильный телефон с золотым золотом, GSM восстановленные сотовые телефоны и русская, ...		2 014,39 - 3 026,25 руб.	//aliexpress.ru/item/33035927503.html?algo_pvid=1e4b98ce-bed6-44ed-8ca1-4ea7fa6b23d6&algo_expid=1e4b98ce-bed6-44ed-8ca1-4ea7fa6b23d6-8&btsid=0b0a182b16006803464174701e5846&ws_ab_test=searchweb0_0,searchweb201602_,searchweb201603_
674697083	Восстановленный Оригинальный мобильный телефон 8250, 2G GSM 900/1800 разблокированный Nokia 8250 и один год гарантии		4 046,68 - 4 358,02 руб.	//aliexpress.ru/item/674697083.html?algo_pvid=1e4b98ce-bed6-44ed-8ca1-4ea7fa6b23d6&algo_expid=1e4b98ce-bed6-44ed-8ca1-4ea7fa6b23d6-9&btsid=0b0a182b16006803464174701e5846&ws_ab_test=searchweb0_0,searchweb201602_,searchweb201603_
32766945958	Разблокированный оригинальный NOKIA C5 C5-00 мобильный телефон Иврит Арабский Русский Клавиатура отремонтированный мобильный телефон	14 продано	1 741,19 - 2 581,81 руб.	//aliexpress.ru/item/32766945958.html?algo_pvid=1e4b98ce-bed6-44ed-8ca1-4ea7fa6b23d6&algo_expid=1e4b98ce-bed6-44ed-8ca1-4ea7fa6b23d6-10&btsid=0b0a182b16006803464174701e5846&ws_ab_test=searchweb0_0,searchweb201602_,searchweb201603_
723913750	Оригинальный сотовый телефон Nokia 6600f, 6600 складной, 2G, 3G, разблокированный сотовый телефон		3 890,23 руб.	//aliexpress.ru/item/723913750.html?algo_pvid=1e4b98ce-bed6-44ed-8ca1-4ea7fa6b23d6&algo_expid=1e4b98ce-bed6-44ed-8ca1-4ea7fa6b23d6-11&btsid=0b0a182b16006803464174701e5846&ws_ab_test=searchweb0_0,searchweb201602_,searchweb201603_
679570984	Разблокированный оригинальный мобильный телефон Sony Ericsson C905 3G GSM 8MP WIFI Bluetooth Восстановленный слайдер сотовый телефон	6 продано	3 252,75 - 3 371,06 руб.	//aliexpress.ru/item/679570984.html?algo_pvid=1e4b98ce-bed6-44ed-8ca1-4ea7fa6b23d6&algo_expid=1e4b98ce-bed6-44ed-8ca1-4ea7fa6b23d6-12&btsid=0b0a182b16006803464174701e5846&ws_ab_test=searchweb0_0,searchweb201602_,searchweb201603_
32965191676	HTC Desire 828 смартфон с 5,5-дюймовым дисплеем, восьмиядерным процессором, ОЗУ 2 Гб, ПЗУ 16 ГБ, 13 МП, 1080P, GPS, Wi-Fi		4 186,78 - 4 809,47 руб.	//aliexpress.ru/item/32965191676.html?algo_pvid=1e4b98ce-bed6-44ed-8ca1-4ea7fa6b23d6&algo_expid=1e4b98ce-bed6-44ed-8ca1-4ea7fa6b23d6-13&btsid=0b0a182b16006803464174701e5846&ws_ab_test=searchweb0_0,searchweb201602_,searchweb201603_
32916221146	Оригинальный сотовый телефон Sony Z5 Premium E6883, восемь ядер, 5,5 дюйма, 3 Гб + 32 ГБ, две SIM-карты, LTE, задняя камера 23 МП, 2160*3840, разблокированный	6 продано	10 117,85 - 10 267,30 руб.	//aliexpress.ru/item/32916221146.html?algo_pvid=1e4b98ce-bed6-44ed-8ca1-4ea7fa6b23d6&algo_expid=1e4b98ce-bed6-44ed-8ca1-4ea7fa6b23d6-14&btsid=0b0a182b16006803464174701e5846&ws_ab_test=searchweb0_0,searchweb201602_,searchweb201603_
32845005946	Смартфон Samsung Galaxy J3 (2016), 8 ГБ, LTE, Android, четыре ядра, 4G LTE, Wi-Fi, GPS		5 930,30 руб.	//aliexpress.ru/item/32845005946.html?algo_pvid=1e4b98ce-bed6-44ed-8ca1-4ea7fa6b23d6&algo_expid=1e4b98ce-bed6-44ed-8ca1-4ea7fa6b23d6-15&btsid=0b0a182b16006803464174701e5846&ws_ab_test=searchweb0_0,searchweb201602_,searchweb201603_
32858563850	Samsung Galaxy On7 2016 смартфон с 5,5-дюймовым дисплеем, восьмиядерным процессором, ОЗУ 3 ГБ, ПЗУ 32 ГБ, 13 МП	1 продано	16 336,92 руб.	//aliexpress.ru/item/32858563850.html?algo_pvid=1e4b98ce-bed6-44ed-8ca1-4ea7fa6b23d6&algo_expid=1e4b98ce-bed6-44ed-8ca1-4ea7fa6b23d6-16&btsid=0b0a182b16006803464174701e5846&ws_ab_test=searchweb0_0,searchweb201602_,searchweb201603_
32845576521	Сотовый телефон Samsung Galaxy ACE S5830 S5830i, 100% оригинал, разблокированный, 3G, Wi-Fi, GPS, камера 5 Мп, один год гарантии, бесплатная доставка	14 продано	1 857,94 - 2 637,08 руб.	//aliexpress.ru/item/32845576521.html?algo_pvid=1e4b98ce-bed6-44ed-8ca1-4ea7fa6b23d6&algo_expid=1e4b98ce-bed6-44ed-8ca1-4ea7fa6b23d6-17&btsid=0b0a182b16006803464174701e5846&ws_ab_test=searchweb0_0,searchweb201602_,searchweb201603_
32417184885	Восстановленный Оригинальный разблокированный Nokia E5, камера 5 Мп, 3G сеть, русская клавиатура, русские languge сотовые телефоны быстро	4 продано	3 385,08 - 3 671,51 руб.	//aliexpress.ru/item/32417184885.html?algo_pvid=1e4b98ce-bed6-44ed-8ca1-4ea7fa6b23d6&algo_expid=1e4b98ce-bed6-44ed-8ca1-4ea7fa6b23d6-18&btsid=0b0a182b16006803464174701e5846&ws_ab_test=searchweb0_0,searchweb201602_,searchweb201603_
32844685449	Мобильный телефон Nokia 2322, Восстановленный Оригинальный 2322 2322c, разблокированный, один год гарантии		2 793,52 - 3 213,84 руб.	//aliexpress.ru/item/32844685449.html?algo_pvid=1e4b98ce-bed6-44ed-8ca1-4ea7fa6b23d6&algo_expid=1e4b98ce-bed6-44ed-8ca1-4ea7fa6b23d6-19&btsid=0b0a182b16006803464174701e5846&ws_ab_test=searchweb0_0,searchweb201602_,searchweb201603_
32281191159	Оригинальный разблокированный мобильный телефон NOKIA 6100, GSM трехдиапазонный Восстановленный сотовый телефон 6100, дешевый телефон, Восстановл...	9 продано	1 411,16 - 2 022,95 руб.	//aliexpress.ru/item/32281191159.html?algo_pvid=1e4b98ce-bed6-44ed-8ca1-4ea7fa6b23d6&algo_expid=1e4b98ce-bed6-44ed-8ca1-4ea7fa6b23d6-20&btsid=0b0a182b16006803464174701e5846&ws_ab_test=searchweb0_0,searchweb201602_,searchweb201603_
32847902327	Разблокированный оригинальный мобильный телефон Nokia X2-01, отремонтированный сотовый телефон Symbian OS, бесплатная доставка		2 331,96 - 2 873,70 руб.	//aliexpress.ru/item/32847902327.html?algo_pvid=1e4b98ce-bed6-44ed-8ca1-4ea7fa6b23d6&algo_expid=1e4b98ce-bed6-44ed-8ca1-4ea7fa6b23d6-21&btsid=0b0a182b16006803464174701e5846&ws_ab_test=searchweb0_0,searchweb201602_,searchweb201603_
723299171	Оригинальный Восстановленный Nokia 6700c 6700, классический мобильный телефон, разблокированный, GPS, 5 МП, MP3, серебристый, 6700c, сотовый телефон с рус...	7 продано	4 176,66 - 4 594,64 руб.	//aliexpress.ru/item/723299171.html?algo_pvid=1e4b98ce-bed6-44ed-8ca1-4ea7fa6b23d6&algo_expid=1e4b98ce-bed6-44ed-8ca1-4ea7fa6b23d6-22&btsid=0b0a182b16006803464174701e5846&ws_ab_test=searchweb0_0,searchweb201602_,searchweb201603_
