id	description	number_of_orders	price	url
1858045935	Разблокированные 9790 оригинальные телефоны blackberry 9790, мобильный телефон 3G, Wi-Fi, GPS, сотовые телефоны с сенсорным экраном, QWERTY клавиатура, 8 Гб ПЗ...	3 продано	3 677,74 - 3 907,35 руб.	//aliexpress.ru/item/1858045935.html?algo_pvid=f19a19c0-dbb2-4e90-a96a-2e98852c5edc&algo_expid=f19a19c0-dbb2-4e90-a96a-2e98852c5edc-46&btsid=0b0a182b16006800467501505e5846&ws_ab_test=searchweb0_0,searchweb201602_,searchweb201603_
32238767217	Оригинальный мобильный телефон Nokia Lumia 625, разблокированный, сенсорный экран 4,7 дюйма, двухъядерный, GPS, Wi-Fi, 3G, 4G сеть, бесплатная доставка, Вос...		6 816,85 руб.	//aliexpress.ru/item/32238767217.html?algo_pvid=f19a19c0-dbb2-4e90-a96a-2e98852c5edc&algo_expid=f19a19c0-dbb2-4e90-a96a-2e98852c5edc-47&btsid=0b0a182b16006800467501505e5846&ws_ab_test=searchweb0_0,searchweb201602_,searchweb201603_
32302383644	Оригинальный мобильный телефон Nokia 6120, классический, 6120c, 3G, оптовая продажа, Nokia 6120, бесплатная доставка, Восстановленный	1 продано	4 280,18 руб.	//aliexpress.ru/item/32302383644.html?algo_pvid=f19a19c0-dbb2-4e90-a96a-2e98852c5edc&algo_expid=f19a19c0-dbb2-4e90-a96a-2e98852c5edc-48&btsid=0b0a182b16006800467501505e5846&ws_ab_test=searchweb0_0,searchweb201602_,searchweb201603_
4000776701555	Оригинальный разблокированный мобильный телефон Nokia Lumia 520, двухъядерный, 3G, Wi-Fi, GPS, 4,0 дюйма, 5 МП, 8 ГБ, Nokia 520, сотовый телефон с Windows, бесплатная ...		2 892,38 - 3 336,82 руб.	//aliexpress.ru/item/4000776701555.html?algo_pvid=f19a19c0-dbb2-4e90-a96a-2e98852c5edc&algo_expid=f19a19c0-dbb2-4e90-a96a-2e98852c5edc-49&btsid=0b0a182b16006800467501505e5846&ws_ab_test=searchweb0_0,searchweb201602_,searchweb201603_
32858163736	Оригинальный мобильный телефон Samsung Galaxy Grand Duos I9082, двухъядерный, две SIM-карты, 5,0 дюйма, 8 Мп, Wi-Fi, GPS, сотовый телефон	3 продано	4 507,46 - 5 239,90 руб.	//aliexpress.ru/item/32858163736.html?algo_pvid=f19a19c0-dbb2-4e90-a96a-2e98852c5edc&algo_expid=f19a19c0-dbb2-4e90-a96a-2e98852c5edc-50&btsid=0b0a182b16006800467501505e5846&ws_ab_test=searchweb0_0,searchweb201602_,searchweb201603_
32881038909	Разблокированный сотовый телефон Samsung Galaxy S5, G900A, G900F, G900V, четырёхъядерный, Wi-Fi, 5,1 дюйма, камера 16 Мп, GPS		9 674,97 - 11 009,07 руб.	//aliexpress.ru/item/32881038909.html?algo_pvid=f19a19c0-dbb2-4e90-a96a-2e98852c5edc&algo_expid=f19a19c0-dbb2-4e90-a96a-2e98852c5edc-51&btsid=0b0a182b16006800467501505e5846&ws_ab_test=searchweb0_0,searchweb201602_,searchweb201603_
32812575506	Оригинальный разблокированный сотовый телефон Nokia Microsoft Lumia 640, камера 8 Мп, четырёхъядерный, 8 Гб ПЗУ, 1 ГБ ОЗУ, мобильный телефон		5 806,54 - 6 696,20 руб.	//aliexpress.ru/item/32812575506.html?algo_pvid=f19a19c0-dbb2-4e90-a96a-2e98852c5edc&algo_expid=f19a19c0-dbb2-4e90-a96a-2e98852c5edc-52&btsid=0b0a182b16006800467501505e5846&ws_ab_test=searchweb0_0,searchweb201602_,searchweb201603_
32815713633	Оригинальный разблокированный Samsung Galaxy S5 mini G800F мобильный телефон, 4,5 дюйма, Android, четырёхъядерный, 1,5 ОЗУ 16 Гб ПЗУ, 8,0 МП, Восстановленный		9 229,75 руб.	//aliexpress.ru/item/32815713633.html?algo_pvid=f19a19c0-dbb2-4e90-a96a-2e98852c5edc&algo_expid=f19a19c0-dbb2-4e90-a96a-2e98852c5edc-53&btsid=0b0a182b16006800467501505e5846&ws_ab_test=searchweb0_0,searchweb201602_,searchweb201603_
4000726935614	Разблокированный оригинальный Смартфон Sony Xperia XZ2, ОЗУ 6 Гб ПЗУ 64 ГБ, мобильный телефон 19MP LTE, 5,7-дюймовый экран, Android, Восьмиядерный, сканер отпе...	1 продано	21 459,28 - 24 136,82 руб.	//aliexpress.ru/item/4000726935614.html?algo_pvid=f19a19c0-dbb2-4e90-a96a-2e98852c5edc&algo_expid=f19a19c0-dbb2-4e90-a96a-2e98852c5edc-54&btsid=0b0a182b16006800467501505e5846&ws_ab_test=searchweb0_0,searchweb201602_,searchweb201603_
32913011894	"Оригинальный разблокированный Samsung Galaxy S7 G930A, мобильный телефон 4G LTE GSM, Android 5,1 "", 12 МП, 4 Гб ОЗУ + 32 Гб ПЗУ, бесплатная доставка"		11 645,77 руб.	//aliexpress.ru/item/32913011894.html?algo_pvid=f19a19c0-dbb2-4e90-a96a-2e98852c5edc&algo_expid=f19a19c0-dbb2-4e90-a96a-2e98852c5edc-55&btsid=0b0a182b16006800467501505e5846&ws_ab_test=searchweb0_0,searchweb201602_,searchweb201603_
32855718762	Разблокированный оригинальный смартфон samsung galaxy S5 Mini G800F, android, 4G LTE, сенсорный экран 4,5 дюйма, 16 Гб ПЗУ, бесплатная доставка		8 473,19 руб.	//aliexpress.ru/item/32855718762.html?algo_pvid=f19a19c0-dbb2-4e90-a96a-2e98852c5edc&algo_expid=f19a19c0-dbb2-4e90-a96a-2e98852c5edc-56&btsid=0b0a182b16006800467501505e5846&ws_ab_test=searchweb0_0,searchweb201602_,searchweb201603_
32332320949	Оригинальный android телефон Samsung galaxy S4 mini I9195, мобильный телефон, разблокированный, 4,3 дюйма, 1,5 Гб ОЗУ, камера 8 МП, бесплатная доставка		6 223,74 руб.	//aliexpress.ru/item/32332320949.html?algo_pvid=f19a19c0-dbb2-4e90-a96a-2e98852c5edc&algo_expid=f19a19c0-dbb2-4e90-a96a-2e98852c5edc-57&btsid=0b0a182b16006800467501505e5846&ws_ab_test=searchweb0_0,searchweb201602_,searchweb201603_
32250418953	Разблокированный сотовый телефон BlackBerry Z10, 100% оригинал, 4,2 дюйма, емкостный сенсорный экран, камера 8 МП		6 139,68 руб.	//aliexpress.ru/item/32250418953.html?algo_pvid=f19a19c0-dbb2-4e90-a96a-2e98852c5edc&algo_expid=f19a19c0-dbb2-4e90-a96a-2e98852c5edc-58&btsid=0b0a182b16006800467501505e5846&ws_ab_test=searchweb0_0,searchweb201602_,searchweb201603_
32823459066	Samsung Galaxy J5 J500F смартфон с 5-дюймовым дисплеем, четырёхъядерным процессором, ОЗУ 1,5 ГБ, ПЗУ 8 ГБ, 13 МП	88 продано	4 874,85 - 4 999,39 руб.	//aliexpress.ru/item/32823459066.html?algo_pvid=f19a19c0-dbb2-4e90-a96a-2e98852c5edc&algo_expid=f19a19c0-dbb2-4e90-a96a-2e98852c5edc-59&btsid=0b0a182b16006800467501505e5846&ws_ab_test=searchweb0_0,searchweb201602_,searchweb201603_
32711574745	Оригинальный разблокированный Blackberry 9900 WCDMA 3G QWERTY клавиатура 8 Гб ROM 5MP Bluetooth WIFI Восстановленный смартфон Бесплатная доставка	68 продано	3 824,07 - 4 674,03 руб.	//aliexpress.ru/item/32711574745.html?algo_pvid=696d77ca-aba5-49e3-ace0-502b7895f2da&algo_expid=696d77ca-aba5-49e3-ace0-502b7895f2da-0&btsid=0b0a182b16006800759512110e5846&ws_ab_test=searchweb0_0,searchweb201602_,searchweb201603_
32800289199	Samsung Galaxy C7 C7000 смартфон с 5,7-дюймовым дисплеем, восьмиядерным процессором, ОЗУ 4 Гб, ПЗУ 64 ГБ, 16 МП, 4G LTE, 3300 мАч, Android 6,0	12 продано	10 116,30 руб.	//aliexpress.ru/item/32800289199.html?algo_pvid=696d77ca-aba5-49e3-ace0-502b7895f2da&algo_expid=696d77ca-aba5-49e3-ace0-502b7895f2da-1&btsid=0b0a182b16006800759512110e5846&ws_ab_test=searchweb0_0,searchweb201602_,searchweb201603_
32356416972	Мобильный телефон Nokia 5310 XpressMusic	576 продано	1 700,71 - 2 569,36 руб.	//aliexpress.ru/item/32356416972.html?algo_pvid=696d77ca-aba5-49e3-ace0-502b7895f2da&algo_expid=696d77ca-aba5-49e3-ace0-502b7895f2da-2&btsid=0b0a182b16006800759512110e5846&ws_ab_test=searchweb0_0,searchweb201602_,searchweb201603_
32845020224	Оригинальный разблокированный сотовый телефон Sony Ericsson Hazel J20 3G 5 МП, Wi-Fi, Bluetooth, Восстановленный, бесплатная доставка	3 продано	3 181,92 руб.	//aliexpress.ru/item/32845020224.html?algo_pvid=696d77ca-aba5-49e3-ace0-502b7895f2da&algo_expid=696d77ca-aba5-49e3-ace0-502b7895f2da-3&btsid=0b0a182b16006800759512110e5846&ws_ab_test=searchweb0_0,searchweb201602_,searchweb201603_
680729018	Лидер продаж! Разблокированный Мобильный телефон Nokia 7610, GSM трехдиапазонная камера, Bluetooth, 7610 оригинал	53 продано	1 937,33 - 2 454,16 руб.	//aliexpress.ru/item/680729018.html?algo_pvid=696d77ca-aba5-49e3-ace0-502b7895f2da&algo_expid=696d77ca-aba5-49e3-ace0-502b7895f2da-4&btsid=0b0a182b16006800759512110e5846&ws_ab_test=searchweb0_0,searchweb201602_,searchweb201603_
32215973162	Оригинальный мобильный телефон Nokia E66, 2G 3G разблокированный Восстановленный слайдер E66, Арабская, русская, Иврит Клавиатура	17 продано	2 602,05 - 3 108,76 руб.	//aliexpress.ru/item/32215973162.html?algo_pvid=696d77ca-aba5-49e3-ace0-502b7895f2da&algo_expid=696d77ca-aba5-49e3-ace0-502b7895f2da-5&btsid=0b0a182b16006800759512110e5846&ws_ab_test=searchweb0_0,searchweb201602_,searchweb201603_
32862594856	Восстановленный Оригинальный мобильный телефон Sony Ericsson W395, 2 МП, разблокированный, W395, гарантия		2 534,33 руб.	//aliexpress.ru/item/32862594856.html?algo_pvid=696d77ca-aba5-49e3-ace0-502b7895f2da&algo_expid=696d77ca-aba5-49e3-ace0-502b7895f2da-6&btsid=0b0a182b16006800759512110e5846&ws_ab_test=searchweb0_0,searchweb201602_,searchweb201603_
33033519306	Смартфон Sony Ericsson W800, 100% оригинальный, 2G, Bluetooth, 2 МП, FM, разблокированный	14 продано	3 035,59 - 3 533,74 руб.	//aliexpress.ru/item/33033519306.html?algo_pvid=696d77ca-aba5-49e3-ace0-502b7895f2da&algo_expid=696d77ca-aba5-49e3-ace0-502b7895f2da-7&btsid=0b0a182b16006800759512110e5846&ws_ab_test=searchweb0_0,searchweb201602_,searchweb201603_
32818405699	Мобильный телефон Nokia, 100% оригинал, разблокированный, две Sim-карты, 2,6 дюйма, 2 Мп, Bluetooth, FM-радио, Java, 1020 мАч	9 продано	3 105,65 - 3 416,99 руб.	//aliexpress.ru/item/32818405699.html?algo_pvid=696d77ca-aba5-49e3-ace0-502b7895f2da&algo_expid=696d77ca-aba5-49e3-ace0-502b7895f2da-8&btsid=0b0a182b16006800759512110e5846&ws_ab_test=searchweb0_0,searchweb201602_,searchweb201603_
32972305573	Лидер продаж! Разблокированный Мобильный телефон Nokia 7610, оригинальный, разблокированный, GSM, трехдиапазонная камера, Bluetooth смартфон, бесплат...	10 продано	2 092,23 - 2 637,08 руб.	//aliexpress.ru/item/32972305573.html?algo_pvid=696d77ca-aba5-49e3-ace0-502b7895f2da&algo_expid=696d77ca-aba5-49e3-ace0-502b7895f2da-9&btsid=0b0a182b16006800759512110e5846&ws_ab_test=searchweb0_0,searchweb201602_,searchweb201603_
32855103649	Оригинальный разблокированный LG V10 H900 4G Android мобильный телефон, шестиядерный, 5,7 дюйма, 16,0 МП, 4 Гб ОЗУ 64 Гб ПЗУ, Восстановленный смартфон 2560*1440	33 продано	5 361,32 - 5 703,80 руб.	//aliexpress.ru/item/32855103649.html?algo_pvid=696d77ca-aba5-49e3-ace0-502b7895f2da&algo_expid=696d77ca-aba5-49e3-ace0-502b7895f2da-10&btsid=0b0a182b16006800759512110e5846&ws_ab_test=searchweb0_0,searchweb201602_,searchweb201603_
32975765169	Nokia Lumia 1320 Оригинальный разблокированный сотовый телефон, двухъядерный, 6-дюймовый сенсорный экран, камера 5 Мп, 3400 мАч, 8 Гб ПЗУ, 1 ГБ ОЗУ		5 783,19 - 6 450,24 руб.	//aliexpress.ru/item/32975765169.html?algo_pvid=696d77ca-aba5-49e3-ace0-502b7895f2da&algo_expid=696d77ca-aba5-49e3-ace0-502b7895f2da-11&btsid=0b0a182b16006800759512110e5846&ws_ab_test=searchweb0_0,searchweb201602_,searchweb201603_
32856100302	Оригинальный мобильный телефон Samsung Galaxy Grand I9082, поддержка двух SIM-карт, сенсорный экран 5,0 дюймов, двухъядерный 8-мегапиксельный сотовый теле...		4 765,88 - 5 457,84 руб.	//aliexpress.ru/item/32856100302.html?algo_pvid=696d77ca-aba5-49e3-ace0-502b7895f2da&algo_expid=696d77ca-aba5-49e3-ace0-502b7895f2da-12&btsid=0b0a182b16006800759512110e5846&ws_ab_test=searchweb0_0,searchweb201602_,searchweb201603_
4000093180576	Samsung Galaxy C5 Pro C5010 смартфон с 5,2-дюймовым дисплеем, ОЗУ 4 Гб, ПЗУ 64 ГБ, 16 Мп, 4G LTE		13 478,02 руб.	//aliexpress.ru/item/4000093180576.html?algo_pvid=696d77ca-aba5-49e3-ace0-502b7895f2da&algo_expid=696d77ca-aba5-49e3-ace0-502b7895f2da-13&btsid=0b0a182b16006800759512110e5846&ws_ab_test=searchweb0_0,searchweb201602_,searchweb201603_
4000777039559	Nokia Microsoft Lumia 640XL смартфон с четырёхъядерным процессором, ОЗУ 1 ГБ, ПЗУ 8 ГБ, 13 МП, 4G WIFI GPS		6 117,10 - 6 895,46 руб.	//aliexpress.ru/item/4000777039559.html?algo_pvid=696d77ca-aba5-49e3-ace0-502b7895f2da&algo_expid=696d77ca-aba5-49e3-ace0-502b7895f2da-14&btsid=0b0a182b16006800759512110e5846&ws_ab_test=searchweb0_0,searchweb201602_,searchweb201603_
4000929864955	Оригинальный разблокированный сотовый телефон LG Q8, 6,2 дюйма, восемь ядер, 4 Гб ОЗУ 64 Гб ПЗУ, камера 16 МП, 1080p, Snapdragon 450, Android q8, 2018		11 009,07 - 11 565,60 руб.	//aliexpress.ru/item/4000929864955.html?algo_pvid=696d77ca-aba5-49e3-ace0-502b7895f2da&algo_expid=696d77ca-aba5-49e3-ace0-502b7895f2da-15&btsid=0b0a182b16006800759512110e5846&ws_ab_test=searchweb0_0,searchweb201602_,searchweb201603_
32815790341	Samsung Galaxy On7 (2016) G6100 смартфон с 5,5-дюймовым дисплеем, восьмиядерным процессором, ОЗУ 3 ГБ, ПЗУ 32 ГБ, 13 МП, 1920x1080		12 654,52 руб.	//aliexpress.ru/item/32815790341.html?algo_pvid=696d77ca-aba5-49e3-ace0-502b7895f2da&algo_expid=696d77ca-aba5-49e3-ace0-502b7895f2da-16&btsid=0b0a182b16006800759512110e5846&ws_ab_test=searchweb0_0,searchweb201602_,searchweb201603_
32363228004	Оригинальный мобильный телефон Samsung Galaxy S4 mini I9195, разблокированный, android, двухъядерный, 4,3 дюйма, 1,5 Гб ОЗУ + 8 Гб ПЗУ, 8 Мп, бесплатная доставка		6 222,96 руб.	//aliexpress.ru/item/32363228004.html?algo_pvid=696d77ca-aba5-49e3-ace0-502b7895f2da&algo_expid=696d77ca-aba5-49e3-ace0-502b7895f2da-17&btsid=0b0a182b16006800759512110e5846&ws_ab_test=searchweb0_0,searchweb201602_,searchweb201603_
4000307391846	G950F оригинальный Samsung Galaxy S8 G950F EU версия, мобильный телефон, 4 аппарат не привязан к оператору сотовой связи 64 Гб 5,8 дюймов 12MP с одной Sim-картой, ...		18 918,73 руб.	//aliexpress.ru/item/4000307391846.html?algo_pvid=696d77ca-aba5-49e3-ace0-502b7895f2da&algo_expid=696d77ca-aba5-49e3-ace0-502b7895f2da-18&btsid=0b0a182b16006800759512110e5846&ws_ab_test=searchweb0_0,searchweb201602_,searchweb201603_
32886842596	Смартфоны Sony Xperia Z L36h C6602 C6603, 5,0-дюймовый сенсорный экран, камера 13,1 Мп, четыре ядра, 2 ГБ ОЗУ 16 ГБ ПЗУ, 3G и 4G, 1080P, оригинальные мобильные телефоны	142 продано	3 210,72 - 3 504,94 руб.	//aliexpress.ru/item/32886842596.html?algo_pvid=696d77ca-aba5-49e3-ace0-502b7895f2da&algo_expid=696d77ca-aba5-49e3-ace0-502b7895f2da-19&btsid=0b0a182b16006800759512110e5846&ws_ab_test=searchweb0_0,searchweb201602_,searchweb201603_
4000913223849	Оригинальный разблокированный LG G6 G600 H870 H873 4 ядра 5,7 дюйма 4 Гб Оперативная память 32GB Встроенная память одной сим-карты, двойной 13.0MP LTE 4G мобил...	56 продано	6 068,07 - 9 027,38 руб.	//aliexpress.ru/item/4000913223849.html?algo_pvid=696d77ca-aba5-49e3-ace0-502b7895f2da&algo_expid=696d77ca-aba5-49e3-ace0-502b7895f2da-20&btsid=0b0a182b16006800759512110e5846&ws_ab_test=searchweb0_0,searchweb201602_,searchweb201603_
4000802084401	Смартфон Nokia Lumia 635, разблокированный, экран 4,5 дюйма, 4 ядра, 8 Гб ПЗУ, 5 МП, Wi-Fi, GPS, 4G LTE	28 продано	2 450,27 - 3 036,37 руб.	//aliexpress.ru/item/4000802084401.html?algo_pvid=696d77ca-aba5-49e3-ace0-502b7895f2da&algo_expid=696d77ca-aba5-49e3-ace0-502b7895f2da-21&btsid=0b0a182b16006800759512110e5846&ws_ab_test=searchweb0_0,searchweb201602_,searchweb201603_
33029165398	Оригинальный смартфон Sony Xperia Z5 E6653, 32 ГБ ОЗУ, 3G GSM WCDMA 4G LTE 23MP Android, Восьмиядерный, 5,2 дюйма, разблокированный мобильный телефон, Smartsphone	109 продано	5 634,52 - 5 880,48 руб.	//aliexpress.ru/item/33029165398.html?algo_pvid=696d77ca-aba5-49e3-ace0-502b7895f2da&algo_expid=696d77ca-aba5-49e3-ace0-502b7895f2da-22&btsid=0b0a182b16006800759512110e5846&ws_ab_test=searchweb0_0,searchweb201602_,searchweb201603_
552750449	Разблокированный Оригинальный сотовый телефон Nokia N9 GSM с сенсорным экраном, 3G, Wi-Fi, камера 8 Мп, мобильный телефон, Восстановленный, бесплатна...	59 продано	2 956,20 руб.	//aliexpress.ru/item/552750449.html?algo_pvid=696d77ca-aba5-49e3-ace0-502b7895f2da&algo_expid=696d77ca-aba5-49e3-ace0-502b7895f2da-23&btsid=0b0a182b16006800759512110e5846&ws_ab_test=searchweb0_0,searchweb201602_,searchweb201603_
4001345921082	"Добавить в «Мои желания» оригинальный Nokia Asha 210 разблокирована GSM 2,4 ""двойной сим-картами 2MP QWERTY клавиатура только на английском языке отремон..."		2 290,71 руб.	//aliexpress.ru/item/4001345921082.html?algo_pvid=696d77ca-aba5-49e3-ace0-502b7895f2da&algo_expid=696d77ca-aba5-49e3-ace0-502b7895f2da-24&btsid=0b0a182b16006800759512110e5846&ws_ab_test=searchweb0_0,searchweb201602_,searchweb201603_
33025591261	Samsung Galaxy J7 J7008 смартфон с 5,5-дюймовым дисплеем, восьмиядерным процессором, ОЗУ 1,5 ГБ, ПЗУ 16 ГБ, 13 МП, Android 5,1		6 847,20 руб.	//aliexpress.ru/item/33025591261.html?algo_pvid=696d77ca-aba5-49e3-ace0-502b7895f2da&algo_expid=696d77ca-aba5-49e3-ace0-502b7895f2da-25&btsid=0b0a182b16006800759512110e5846&ws_ab_test=searchweb0_0,searchweb201602_,searchweb201603_
4001107660517	HTC One X10 смартфон с 5,5-дюймовым дисплеем, восьмиядерным процессором, ОЗУ 3 ГБ, ПЗУ 32 ГБ, 16 МП, ANDROID	7 продано	5 671,89 - 6 621,48 руб.	//aliexpress.ru/item/4001107660517.html?algo_pvid=696d77ca-aba5-49e3-ace0-502b7895f2da&algo_expid=696d77ca-aba5-49e3-ace0-502b7895f2da-26&btsid=0b0a182b16006800759512110e5846&ws_ab_test=searchweb0_0,searchweb201602_,searchweb201603_
32434850654	6610 оригинальная разблокированная Nokia 6610 старая дешевая Поддержка Русская и арабская клавиатура отремонтированный сотовый телефон без каме...		1 401,05 - 1 471,10 руб.	//aliexpress.ru/item/32434850654.html?algo_pvid=696d77ca-aba5-49e3-ace0-502b7895f2da&algo_expid=696d77ca-aba5-49e3-ace0-502b7895f2da-27&btsid=0b0a182b16006800759512110e5846&ws_ab_test=searchweb0_0,searchweb201602_,searchweb201603_
670489469	Оригинальный мобильный телефон NOKIA N95, 8 ГБ, 3G, 5 МП, Wi-Fi, GPS, 2,8 дюйма, GSM разблокированный смартфон, русская и Арабская клавиатуры	155 продано	3 073,73 - 3 741,56 руб.	//aliexpress.ru/item/670489469.html?algo_pvid=696d77ca-aba5-49e3-ace0-502b7895f2da&algo_expid=696d77ca-aba5-49e3-ace0-502b7895f2da-28&btsid=0b0a182b16006800759512110e5846&ws_ab_test=searchweb0_0,searchweb201602_,searchweb201603_
32826766047	Оригинальный разблокированный мобильный телефон NOKIA 1280 GSM, Восстановленный телефон с русской и арабской клавиатурой	52 продано	1 618,21 - 2 054,09 руб.	//aliexpress.ru/item/32826766047.html?algo_pvid=696d77ca-aba5-49e3-ace0-502b7895f2da&algo_expid=696d77ca-aba5-49e3-ace0-502b7895f2da-29&btsid=0b0a182b16006800759512110e5846&ws_ab_test=searchweb0_0,searchweb201602_,searchweb201603_
724708209	Восстановленный Оригинальный сотовый телефон Nokia 5310 XpressMusic, разблокированный	18 продано	1 729,51 - 2 159,16 руб.	//aliexpress.ru/item/724708209.html?algo_pvid=696d77ca-aba5-49e3-ace0-502b7895f2da&algo_expid=696d77ca-aba5-49e3-ace0-502b7895f2da-30&btsid=0b0a182b16006800759512110e5846&ws_ab_test=searchweb0_0,searchweb201602_,searchweb201603_
724291362	Отремонтированный сотовый телефон Nokia Flip 3710f, 3710 оригинал, разблокированный, 3G, МП, английская, русская, Арабская, Иврит Клавиатура	19 продано	4 303,54 - 4 793,90 руб.	//aliexpress.ru/item/724291362.html?algo_pvid=696d77ca-aba5-49e3-ace0-502b7895f2da&algo_expid=696d77ca-aba5-49e3-ace0-502b7895f2da-31&btsid=0b0a182b16006800759512110e5846&ws_ab_test=searchweb0_0,searchweb201602_,searchweb201603_
4000843097284	Мобильный телефон BlackBerry 9300 Curve, 100% оригинал, разблокированный смартфон, 3G, Wi-Fi, восстановленные сотовые телефоны, бесплатная доставка		2 481,40 - 3 034,82 руб.	//aliexpress.ru/item/4000843097284.html?algo_pvid=696d77ca-aba5-49e3-ace0-502b7895f2da&algo_expid=696d77ca-aba5-49e3-ace0-502b7895f2da-32&btsid=0b0a182b16006800759512110e5846&ws_ab_test=searchweb0_0,searchweb201602_,searchweb201603_
32964030605	3650 100% Оригинальный разблокированный телефон Nokia 3650, 2,1 дюйма, GSM 2G Symbian 6,1, мобильный телефон с гарантией на один год, бесплатная доставка		7 416,96 - 8 117,48 руб.	//aliexpress.ru/item/32964030605.html?algo_pvid=696d77ca-aba5-49e3-ace0-502b7895f2da&algo_expid=696d77ca-aba5-49e3-ace0-502b7895f2da-33&btsid=0b0a182b16006800759512110e5846&ws_ab_test=searchweb0_0,searchweb201602_,searchweb201603_
32918011749	Сотовый телефон Sony Xperia Z3 Compact D5803, GSM, 4G LTE, Android, четырёхъядерный, 2 Гб ОЗУ 16 Гб ПЗУ, 4,6 дюйма, Wi-Fi, GPS, аккумулятор 2600 мАч	5 продано	5 629,08 - 6 083,64 руб.	//aliexpress.ru/item/32918011749.html?algo_pvid=696d77ca-aba5-49e3-ace0-502b7895f2da&algo_expid=696d77ca-aba5-49e3-ace0-502b7895f2da-34&btsid=0b0a182b16006800759512110e5846&ws_ab_test=searchweb0_0,searchweb201602_,searchweb201603_
1703691545	Восстановленный Оригинальный Мобильный телефон NOKIA 6600, Bluetooth Камера разблокирована, GSM трехдиапазонный белый и один год гарантии	39 продано	3 150,79 - 3 687,86 руб.	//aliexpress.ru/item/1703691545.html?algo_pvid=696d77ca-aba5-49e3-ace0-502b7895f2da&algo_expid=696d77ca-aba5-49e3-ace0-502b7895f2da-35&btsid=0b0a182b16006800759512110e5846&ws_ab_test=searchweb0_0,searchweb201602_,searchweb201603_
32792146321	Оригинальный разблокированный сотовый телефон Nokia Lumia 625, мобильный телефон, 4,7 дюйма, двухъядерный, 8 Гб ПЗУ, GPS, Wi-Fi, 3G и 4G, телефон Microsoft Windows		4 266,17 - 4 811,80 руб.	//aliexpress.ru/item/32792146321.html?algo_pvid=696d77ca-aba5-49e3-ace0-502b7895f2da&algo_expid=696d77ca-aba5-49e3-ace0-502b7895f2da-36&btsid=0b0a182b16006800759512110e5846&ws_ab_test=searchweb0_0,searchweb201602_,searchweb201603_
4000767302771	Оригинальный разблокированный Samsung Galaxy S3 i9300, Android 4,1, 3G сеть GSM 4,8 дюйма, камера 8 МП, GPS, Wi-Fi, Восстановленный смартфон		6 117,10 - 6 672,85 руб.	//aliexpress.ru/item/4000767302771.html?algo_pvid=696d77ca-aba5-49e3-ace0-502b7895f2da&algo_expid=696d77ca-aba5-49e3-ace0-502b7895f2da-37&btsid=0b0a182b16006800759512110e5846&ws_ab_test=searchweb0_0,searchweb201602_,searchweb201603_
