id	description	number_of_orders	price	url
1005001286263227	"Оригинальный Sony Xperia XZ2 разблокирована оперативная память 4 Гб ROM 64 Гб мобильный телефон 19MP LTE 5,7 ""Android мобильный телефон, четыре ядра, смартфон ..."	3 продано	17 902,97 - 18 292,15 руб.	//aliexpress.ru/item/1005001286263227.html?algo_pvid=1e20ebb9-1d71-4abd-be67-47789e6d8fd2&algo_expid=1e20ebb9-1d71-4abd-be67-47789e6d8fd2-21&btsid=0b0a182b16006795624976738e5846&ws_ab_test=searchweb0_0,searchweb201602_,searchweb201603_
1893882059	Оригинальный Восстановленный разблокированный SAMSUNG S3600, мобильный телефон с английской и русской клавиатурой, один год гарантии	30 продано	1 742,74 - 2 178,62 руб.	//aliexpress.ru/item/1893882059.html?algo_pvid=1e20ebb9-1d71-4abd-be67-47789e6d8fd2&algo_expid=1e20ebb9-1d71-4abd-be67-47789e6d8fd2-22&btsid=0b0a182b16006795624976738e5846&ws_ab_test=searchweb0_0,searchweb201602_,searchweb201603_
4001008131364	"Оригинальный разлоченый мобильный телефон Dual sim LG G7 ThinQ G710EMW 6,1 ""4 Гб + 64 Гб Snapdragon845 двойные задние Камера LTE (без лака)"	22 продано	11 430,16 руб.	//aliexpress.ru/item/4001008131364.html?algo_pvid=1e20ebb9-1d71-4abd-be67-47789e6d8fd2&algo_expid=1e20ebb9-1d71-4abd-be67-47789e6d8fd2-23&btsid=0b0a182b16006795624976738e5846&ws_ab_test=searchweb0_0,searchweb201602_,searchweb201603_
4000379314376	Разблокированный Оригинальный сотовый телефон Motorola Krzr K1, GSM, Bluetooth, MP3, FM радио, бесплатная доставка	7 продано	2 792,75 - 3 866,88 руб.	//aliexpress.ru/item/4000379314376.html?algo_pvid=1e20ebb9-1d71-4abd-be67-47789e6d8fd2&algo_expid=1e20ebb9-1d71-4abd-be67-47789e6d8fd2-24&btsid=0b0a182b16006795624976738e5846&ws_ab_test=searchweb0_0,searchweb201602_,searchweb201603_
4000417680568	Сотовый телефон Samsung S7568, Android, 4 Гб ПЗУ, Wi-Fi, GPS, четырёхъядерный, сенсорный экран 4,0 дюйма, мобильный телефон		2 824,66 - 3 865,32 руб.	//aliexpress.ru/item/4000417680568.html?algo_pvid=1e20ebb9-1d71-4abd-be67-47789e6d8fd2&algo_expid=1e20ebb9-1d71-4abd-be67-47789e6d8fd2-25&btsid=0b0a182b16006795624976738e5846&ws_ab_test=searchweb0_0,searchweb201602_,searchweb201603_
32906641009	Разблокированный телефон Nokia Lumia 930, четырёхъядерный, экран 5 дюймов, 2 Гб ОЗУ 32 Гб ПЗУ, камера 20 МП, LTE, Windows	28 продано	4 484,11 - 4 548,72 руб.	//aliexpress.ru/item/32906641009.html?algo_pvid=1e20ebb9-1d71-4abd-be67-47789e6d8fd2&algo_expid=1e20ebb9-1d71-4abd-be67-47789e6d8fd2-26&btsid=0b0a182b16006795624976738e5846&ws_ab_test=searchweb0_0,searchweb201602_,searchweb201603_
32794136989	Оригинальный мобильный телефон Samsung Galaxy Mega, 5,8 дюйма, 8 Гб ПЗУ, 1,5 Гб ОЗУ, двухъядерный	68 продано	3 413,10 - 3 704,98 руб.	//aliexpress.ru/item/32794136989.html?algo_pvid=1e20ebb9-1d71-4abd-be67-47789e6d8fd2&algo_expid=1e20ebb9-1d71-4abd-be67-47789e6d8fd2-27&btsid=0b0a182b16006795624976738e5846&ws_ab_test=searchweb0_0,searchweb201602_,searchweb201603_
32642579926	Мобильный телефон Samsung S5, разблокированный, четырёхъядерный, 5,1 дюйма, 3G и 4G, 16 МП, GPS, Wi-Fi	3 продано	6 774,82 - 7 039,46 руб.	//aliexpress.ru/item/32642579926.html?algo_pvid=1e20ebb9-1d71-4abd-be67-47789e6d8fd2&algo_expid=1e20ebb9-1d71-4abd-be67-47789e6d8fd2-28&btsid=0b0a182b16006795624976738e5846&ws_ab_test=searchweb0_0,searchweb201602_,searchweb201603_
32319083294	Оригинальный мобильный телефон blackberry 9900, смелая английская клавиатура 9900 с камерой 5 МП, бесплатная доставка	9 продано	4 978,37 руб.	//aliexpress.ru/item/32319083294.html?algo_pvid=1e20ebb9-1d71-4abd-be67-47789e6d8fd2&algo_expid=1e20ebb9-1d71-4abd-be67-47789e6d8fd2-29&btsid=0b0a182b16006795624976738e5846&ws_ab_test=searchweb0_0,searchweb201602_,searchweb201603_
32231049228	Оригинальный Nokia 2700C 2700, классический разблокированный мобильный телефон GSM 2MP FM MP3-плеер, дешевый телефон nokia, бесплатная доставка	12 продано	1 833,03 - 2 437,82 руб.	//aliexpress.ru/item/32231049228.html?algo_pvid=1e20ebb9-1d71-4abd-be67-47789e6d8fd2&algo_expid=1e20ebb9-1d71-4abd-be67-47789e6d8fd2-30&btsid=0b0a182b16006795624976738e5846&ws_ab_test=searchweb0_0,searchweb201602_,searchweb201603_
32363891778	Оригинальный разблокированный Nokia 6060, мобильный телефон DualBand JAVA Classic GSM, недорогой сотовый телефон Nokia 6060, высокое качество, бесплатная доста...	47 продано	2 513,32 - 2 758,50 руб.	//aliexpress.ru/item/32363891778.html?algo_pvid=1e20ebb9-1d71-4abd-be67-47789e6d8fd2&algo_expid=1e20ebb9-1d71-4abd-be67-47789e6d8fd2-31&btsid=0b0a182b16006795624976738e5846&ws_ab_test=searchweb0_0,searchweb201602_,searchweb201603_
32851687265	Разблокированный Мобильный телефон Nokia X3, оригинальный, с русской клавиатурой, 3,2 МП, 2,2 дюйма, 860 мАч, с Bluetooth-слайдером	80 продано	2 017,50 - 2 076,66 руб.	//aliexpress.ru/item/32851687265.html?algo_pvid=1e20ebb9-1d71-4abd-be67-47789e6d8fd2&algo_expid=1e20ebb9-1d71-4abd-be67-47789e6d8fd2-32&btsid=0b0a182b16006795624976738e5846&ws_ab_test=searchweb0_0,searchweb201602_,searchweb201603_
4001262199892	6600f оригинальный Nokia 6600f Bluetooth 3G складной разблокированный отремонтированный сотовый телефон Бесплатная доставка		2 950,75 - 3 297,12 руб.	//aliexpress.ru/item/4001262199892.html?algo_pvid=1e20ebb9-1d71-4abd-be67-47789e6d8fd2&algo_expid=1e20ebb9-1d71-4abd-be67-47789e6d8fd2-33&btsid=0b0a182b16006795624976738e5846&ws_ab_test=searchweb0_0,searchweb201602_,searchweb201603_
680729018	Лидер продаж! Разблокированный Мобильный телефон Nokia 7610, GSM трехдиапазонная камера, Bluetooth, 7610 оригинал	53 продано	1 937,33 - 2 454,16 руб.	//aliexpress.ru/item/680729018.html?algo_pvid=1e20ebb9-1d71-4abd-be67-47789e6d8fd2&algo_expid=1e20ebb9-1d71-4abd-be67-47789e6d8fd2-34&btsid=0b0a182b16006795624976738e5846&ws_ab_test=searchweb0_0,searchweb201602_,searchweb201603_
4001352039607	"Оригинальный Sony Xperia Z1 Compact D5503 мобильный телефон 3G/4G Android четырехъядерный 2 Гб RAM 4,3 ""экран 20.7MP камера WIFI GPS 16 Гб хранение"	5 продано	3 871,55 - 4 259,95 руб.	//aliexpress.ru/item/4001352039607.html?algo_pvid=1e20ebb9-1d71-4abd-be67-47789e6d8fd2&algo_expid=1e20ebb9-1d71-4abd-be67-47789e6d8fd2-35&btsid=0b0a182b16006795624976738e5846&ws_ab_test=searchweb0_0,searchweb201602_,searchweb201603_
32845764589	Разблокированный сотовый телефон Nokia 1208, 1208 оригинал, дешевые сотовые телефоны GSM, Восстановленный телефон	26 продано	2 023,73 - 2 349,08 руб.	//aliexpress.ru/item/32845764589.html?algo_pvid=1e20ebb9-1d71-4abd-be67-47789e6d8fd2&algo_expid=1e20ebb9-1d71-4abd-be67-47789e6d8fd2-36&btsid=0b0a182b16006795624976738e5846&ws_ab_test=searchweb0_0,searchweb201602_,searchweb201603_
4001203651293	A600F оригинальный Samsung Galaxy A6 (2018) 5,6 дюйма Восьмиядерный 3 ГБ ОЗУ 32 Гб ПЗУ LTE 4G 16 МП камера Две sim-карты разблокированный мобильный телефон		10 577,08 руб.	//aliexpress.ru/item/4001203651293.html?algo_pvid=1e20ebb9-1d71-4abd-be67-47789e6d8fd2&algo_expid=1e20ebb9-1d71-4abd-be67-47789e6d8fd2-37&btsid=0b0a182b16006795624976738e5846&ws_ab_test=searchweb0_0,searchweb201602_,searchweb201603_
33022013440	Оригинальный смартфон Nokia X6 на базе Android, 5,8-дюймовый экран 18:9, Восьмиядерный процессор Snapdragon 636, 3060 мАч, камера 16 Мп + 5 МП, сканер отпечатка пал...	21 продано	9 778,49 - 10 965,48 руб.	//aliexpress.ru/item/33022013440.html?algo_pvid=1e20ebb9-1d71-4abd-be67-47789e6d8fd2&algo_expid=1e20ebb9-1d71-4abd-be67-47789e6d8fd2-38&btsid=0b0a182b16006795624976738e5846&ws_ab_test=searchweb0_0,searchweb201602_,searchweb201603_
32820200624	Samsung Galaxy Folder G1600(2016) смартфон с 3,8-дюймовым дисплеем, четырёхъядерным процессором, ОЗУ 2 Гб, ПЗУ 16 Гб, 2-мя слотами для sim-карт, 1,4 ГГц, LTE	21 продано	11 107,92 руб.	//aliexpress.ru/item/32820200624.html?algo_pvid=1e20ebb9-1d71-4abd-be67-47789e6d8fd2&algo_expid=1e20ebb9-1d71-4abd-be67-47789e6d8fd2-39&btsid=0b0a182b16006795624976738e5846&ws_ab_test=searchweb0_0,searchweb201602_,searchweb201603_
4001271089058	Оригинальный разблокированный сотовый телефон Sony Xperia Z C6603, экран 5 дюймов, четырёхъядерный, 2 Гб ОЗУ 16 Гб ПЗУ, камера 13,1 МП		3 424,77 - 3 736,11 руб.	//aliexpress.ru/item/4001271089058.html?algo_pvid=1e20ebb9-1d71-4abd-be67-47789e6d8fd2&algo_expid=1e20ebb9-1d71-4abd-be67-47789e6d8fd2-41&btsid=0b0a182b16006795624976738e5846&ws_ab_test=searchweb0_0,searchweb201602_,searchweb201603_
33009918397	Оригинальный телефон NOKIA 208 с одной Sim-картой, GSM, хорошее качество, разблокированный Восстановленный мобильный телефон, иврит, Арабская, русс...	11 продано	3 104,09 - 4 365,03 руб.	//aliexpress.ru/item/33009918397.html?algo_pvid=1e20ebb9-1d71-4abd-be67-47789e6d8fd2&algo_expid=1e20ebb9-1d71-4abd-be67-47789e6d8fd2-42&btsid=0b0a182b16006795624976738e5846&ws_ab_test=searchweb0_0,searchweb201602_,searchweb201603_
690314013	Восстановленный Мобильный телефон Nokia 6230, GSM трехдиапазонный разблокированный и английский, русский, арабская клавиатура, старый дешевый те...	11 продано	1 375,36 - 1 745,86 руб.	//aliexpress.ru/item/690314013.html?algo_pvid=1e20ebb9-1d71-4abd-be67-47789e6d8fd2&algo_expid=1e20ebb9-1d71-4abd-be67-47789e6d8fd2-43&btsid=0b0a182b16006795624976738e5846&ws_ab_test=searchweb0_0,searchweb201602_,searchweb201603_
4000843162557	Разблокированный оригинальный мобильный телефон NOKIA 3310, 2G GSM, недорогой отремонтированный сотовый телефон, не работает в Северной Америке	58 продано	1 286,63 - 1 812,80 руб.	//aliexpress.ru/item/4000843162557.html?algo_pvid=1e20ebb9-1d71-4abd-be67-47789e6d8fd2&algo_expid=1e20ebb9-1d71-4abd-be67-47789e6d8fd2-44&btsid=0b0a182b16006795624976738e5846&ws_ab_test=searchweb0_0,searchweb201602_,searchweb201603_
4001115912618	Разблокированный оригинальный Nokia 7 plus 4 Гб + 64 Гб Qualcomm660 одиночный/двусимочный 6 дюймов полный Экран двойной Камера отпечатков пальцев 4G-LTE	25 продано	10 831,61 - 11 594,40 руб.	//aliexpress.ru/item/4001115912618.html?algo_pvid=1e20ebb9-1d71-4abd-be67-47789e6d8fd2&algo_expid=1e20ebb9-1d71-4abd-be67-47789e6d8fd2-45&btsid=0b0a182b16006795624976738e5846&ws_ab_test=searchweb0_0,searchweb201602_,searchweb201603_
674581082	Разблокированный трехдиапазонный мобильный телефон Nokia 3100, 2G GSM, отремонтированный дешевый сотовый телефон Nokia	44 продано	1 193,22 - 1 703,05 руб.	//aliexpress.ru/item/674581082.html?algo_pvid=1e20ebb9-1d71-4abd-be67-47789e6d8fd2&algo_expid=1e20ebb9-1d71-4abd-be67-47789e6d8fd2-46&btsid=0b0a182b16006795624976738e5846&ws_ab_test=searchweb0_0,searchweb201602_,searchweb201603_
4000739693295	Оригинальный разблокированный Nokia Microsoft Lumia 950, экран 5,2 дюйма, десять ядер, LTE, 4 Гб 32 Гб ПЗУ, 3 Гб ОЗУ, 20 МП, FDD, сенсорный экран, Windows, мобильный тел...	12 продано	6 717,22 - 7 608,43 руб.	//aliexpress.ru/item/4000739693295.html?algo_pvid=1e20ebb9-1d71-4abd-be67-47789e6d8fd2&algo_expid=1e20ebb9-1d71-4abd-be67-47789e6d8fd2-47&btsid=0b0a182b16006795624976738e5846&ws_ab_test=searchweb0_0,searchweb201602_,searchweb201603_
32820684054	Отремонтированный мобильный телефон Sony Ericsson W850, Bluetooth, 2 МП, разблокированный, W850i, бесплатная доставка	5 продано	4 202,35 руб.	//aliexpress.ru/item/32820684054.html?algo_pvid=1e20ebb9-1d71-4abd-be67-47789e6d8fd2&algo_expid=1e20ebb9-1d71-4abd-be67-47789e6d8fd2-48&btsid=0b0a182b16006795624976738e5846&ws_ab_test=searchweb0_0,searchweb201602_,searchweb201603_
4000940896522	Разблокированный Оригинальный сотовый телефон NOKIA 215, две Sim-карты, GSM, хорошее качество, Восстановленный Мобильный телефон Nokia 215 DS	5 продано	1 971,58 - 2 594,27 руб.	//aliexpress.ru/item/4000940896522.html?algo_pvid=1e20ebb9-1d71-4abd-be67-47789e6d8fd2&algo_expid=1e20ebb9-1d71-4abd-be67-47789e6d8fd2-49&btsid=0b0a182b16006795624976738e5846&ws_ab_test=searchweb0_0,searchweb201602_,searchweb201603_
4000459903937	Оригинальный разблокированный LG F460 LG G3 Prime G3 Cat.6, 5,5-дюймовый экран, 3 Гб ОЗУ 32 Гб ПЗУ, 13,0 МП, 4G, Wi-Fi, мобильный телефон, бесплатная доставка	10 продано	4 921,55 - 5 772,29 руб.	//aliexpress.ru/item/4000459903937.html?algo_pvid=1e20ebb9-1d71-4abd-be67-47789e6d8fd2&algo_expid=1e20ebb9-1d71-4abd-be67-47789e6d8fd2-50&btsid=0b0a182b16006795624976738e5846&ws_ab_test=searchweb0_0,searchweb201602_,searchweb201603_
32823579495	Разблокированный Оригинальный сотовый телефон Nokia Lumia 735, 4,7 дюйма, 8 Гб ПЗУ, 1 ГБ ОЗУ, четырёхъядерный, LTE, Windows, Восстановленный мобильный телеф...		4 343,23 руб.	//aliexpress.ru/item/32823579495.html?algo_pvid=1e20ebb9-1d71-4abd-be67-47789e6d8fd2&algo_expid=1e20ebb9-1d71-4abd-be67-47789e6d8fd2-51&btsid=0b0a182b16006795624976738e5846&ws_ab_test=searchweb0_0,searchweb201602_,searchweb201603_
4000848693595	Оригинальный разблокированный мобильный телефон Nokia 7230, 2G GSM, Восстановленный сотовый телефон, английская, русская, иврит, арабская клавиату...	12 продано	1 925,66 - 2 002,71 руб.	//aliexpress.ru/item/4000848693595.html?algo_pvid=1e20ebb9-1d71-4abd-be67-47789e6d8fd2&algo_expid=1e20ebb9-1d71-4abd-be67-47789e6d8fd2-52&btsid=0b0a182b16006795624976738e5846&ws_ab_test=searchweb0_0,searchweb201602_,searchweb201603_
4000989055610	Смартфон Samsung S6 Active G890a, 5,1-дюймовый экран, процессор Qcta Core, 3 Гб ОЗУ 32 Гб ПЗУ, камера 16 МП, LTE, 4G, Android, разблокированный мобильный телефон	46 продано	8 198,43 руб.	//aliexpress.ru/item/4000989055610.html?algo_pvid=1e20ebb9-1d71-4abd-be67-47789e6d8fd2&algo_expid=1e20ebb9-1d71-4abd-be67-47789e6d8fd2-53&btsid=0b0a182b16006795624976738e5846&ws_ab_test=searchweb0_0,searchweb201602_,searchweb201603_
724717466	Оригинальный мобильный телефон Nokia 5310 XpressMusic, восстановленные разблокированные сотовые телефоны, английская, Арабская, русская клавиатура	18 продано	1 729,51 - 2 152,16 руб.	//aliexpress.ru/item/724717466.html?algo_pvid=1e20ebb9-1d71-4abd-be67-47789e6d8fd2&algo_expid=1e20ebb9-1d71-4abd-be67-47789e6d8fd2-54&btsid=0b0a182b16006795624976738e5846&ws_ab_test=searchweb0_0,searchweb201602_,searchweb201603_
742173478	Восстановленный Оригинальный мобильный телефон Sony Ericsson WT19i, 5 МП, Wi-Fi, разблокированный Android		3 875,44 руб.	//aliexpress.ru/item/742173478.html?algo_pvid=1e20ebb9-1d71-4abd-be67-47789e6d8fd2&algo_expid=1e20ebb9-1d71-4abd-be67-47789e6d8fd2-55&btsid=0b0a182b16006795624976738e5846&ws_ab_test=searchweb0_0,searchweb201602_,searchweb201603_
32817527020	Разблокированный оригинальный мобильный телефон Nokia Microsoft Lumia 950, 5,2 дюйма, четырёхъядерный, LTE, 32 Гб ПЗУ, 20 МП, Windows, Восстановленный	3 продано	6 952,28 руб.	//aliexpress.ru/item/32817527020.html?algo_pvid=1e20ebb9-1d71-4abd-be67-47789e6d8fd2&algo_expid=1e20ebb9-1d71-4abd-be67-47789e6d8fd2-56&btsid=0b0a182b16006795624976738e5846&ws_ab_test=searchweb0_0,searchweb201602_,searchweb201603_
4000781011995	Оригинальный телефон Nokia X2, Bluetooth, FM, JAVA, 5 МП, разблокированный мобильный телефон с поддержкой клавиатуры на английском, русском, иврите, араб...	24 продано	2 114,02 - 2 892,38 руб.	//aliexpress.ru/item/4000781011995.html?algo_pvid=1e20ebb9-1d71-4abd-be67-47789e6d8fd2&algo_expid=1e20ebb9-1d71-4abd-be67-47789e6d8fd2-57&btsid=0b0a182b16006795624976738e5846&ws_ab_test=searchweb0_0,searchweb201602_,searchweb201603_
4001119689283	Оригинальный разблокированный мобильный телефон Nokia 3310 (2017), Две сим-карты, 2,4 дюйма, 2G GSM, версия 3310 (2017), Восстановленный цветной сотовый теле...	3 продано	2 724,25 - 3 191,26 руб.	//aliexpress.ru/item/4001119689283.html?algo_pvid=1e20ebb9-1d71-4abd-be67-47789e6d8fd2&algo_expid=1e20ebb9-1d71-4abd-be67-47789e6d8fd2-58&btsid=0b0a182b16006795624976738e5846&ws_ab_test=searchweb0_0,searchweb201602_,searchweb201603_
32695783327	Бесплатная доставка, Восстановленный Оригинальный Nokia 3100, разблокированный мобильный телефон, один год гарантии	30 продано	1 244,60 - 1 711,61 руб.	//aliexpress.ru/item/32695783327.html?algo_pvid=1e20ebb9-1d71-4abd-be67-47789e6d8fd2&algo_expid=1e20ebb9-1d71-4abd-be67-47789e6d8fd2-59&btsid=0b0a182b16006795624976738e5846&ws_ab_test=searchweb0_0,searchweb201602_,searchweb201603_
670489469	Оригинальный мобильный телефон NOKIA N95, 8 ГБ, 3G, 5 МП, Wi-Fi, GPS, 2,8 дюйма, GSM разблокированный смартфон, русская и Арабская клавиатуры	155 продано	3 073,73 - 3 741,56 руб.	//aliexpress.ru/item/670489469.html?algo_pvid=379ccd46-835d-48bb-a742-8cc9b93532bc&algo_expid=379ccd46-835d-48bb-a742-8cc9b93532bc-0&btsid=0b0a182b16006796278531579e5846&ws_ab_test=searchweb0_0,searchweb201602_,searchweb201603_
32823579495	Разблокированный Оригинальный сотовый телефон Nokia Lumia 735, 4,7 дюйма, 8 Гб ПЗУ, 1 ГБ ОЗУ, четырёхъядерный, LTE, Windows, Восстановленный мобильный телеф...		4 343,23 руб.	//aliexpress.ru/item/32823579495.html?algo_pvid=379ccd46-835d-48bb-a742-8cc9b93532bc&algo_expid=379ccd46-835d-48bb-a742-8cc9b93532bc-1&btsid=0b0a182b16006796278531579e5846&ws_ab_test=searchweb0_0,searchweb201602_,searchweb201603_
4000458188679	Оригинальный разблокированный сотовый телефон Nokia 3310 (2017), 2G, 2 МП, две SIM-карты, восстановленные	49 продано	2 836,33 - 2 962,43 руб.	//aliexpress.ru/item/4000458188679.html?algo_pvid=379ccd46-835d-48bb-a742-8cc9b93532bc&algo_expid=379ccd46-835d-48bb-a742-8cc9b93532bc-2&btsid=0b0a182b16006796278531579e5846&ws_ab_test=searchweb0_0,searchweb201602_,searchweb201603_
32890302084	HTC U11 смартфон с 5,5-дюймовым дисплеем, восьмиядерным процессором Qualcomm 835, ОЗУ 4 Гб, ПЗУ 64 ГБ, 4G LTE	29 продано	11 678,46 руб.	//aliexpress.ru/item/32890302084.html?algo_pvid=379ccd46-835d-48bb-a742-8cc9b93532bc&algo_expid=379ccd46-835d-48bb-a742-8cc9b93532bc-3&btsid=0b0a182b16006796278531579e5846&ws_ab_test=searchweb0_0,searchweb201602_,searchweb201603_
33032037331	Восстановленный Оригинальный разблокированный мобильный телефон Motorola V8, 2 МП, сотовый телефон с 512 М или 2 Гб ПЗУ, бесплатная доставка	40 продано	3 086,96 - 4 008,54 руб.	//aliexpress.ru/item/33032037331.html?algo_pvid=379ccd46-835d-48bb-a742-8cc9b93532bc&algo_expid=379ccd46-835d-48bb-a742-8cc9b93532bc-4&btsid=0b0a182b16006796278531579e5846&ws_ab_test=searchweb0_0,searchweb201602_,searchweb201603_
32215973162	Оригинальный мобильный телефон Nokia E66, 2G 3G разблокированный Восстановленный слайдер E66, Арабская, русская, Иврит Клавиатура	17 продано	2 602,05 - 3 108,76 руб.	//aliexpress.ru/item/32215973162.html?algo_pvid=379ccd46-835d-48bb-a742-8cc9b93532bc&algo_expid=379ccd46-835d-48bb-a742-8cc9b93532bc-5&btsid=0b0a182b16006796278531579e5846&ws_ab_test=searchweb0_0,searchweb201602_,searchweb201603_
682332504	Восстановленный Оригинальный мобильный телефон Sony Ericsson W595, разблокированный сотовый телефон с цветами W595		2 303,16 - 3 361,72 руб.	//aliexpress.ru/item/682332504.html?algo_pvid=379ccd46-835d-48bb-a742-8cc9b93532bc&algo_expid=379ccd46-835d-48bb-a742-8cc9b93532bc-6&btsid=0b0a182b16006796278531579e5846&ws_ab_test=searchweb0_0,searchweb201602_,searchweb201603_
32817527020	Разблокированный оригинальный мобильный телефон Nokia Microsoft Lumia 950, 5,2 дюйма, четырёхъядерный, LTE, 32 Гб ПЗУ, 20 МП, Windows, Восстановленный	3 продано	6 952,28 руб.	//aliexpress.ru/item/32817527020.html?algo_pvid=379ccd46-835d-48bb-a742-8cc9b93532bc&algo_expid=379ccd46-835d-48bb-a742-8cc9b93532bc-7&btsid=0b0a182b16006796278531579e5846&ws_ab_test=searchweb0_0,searchweb201602_,searchweb201603_
4000317541500	Мобильный телефон Samsung Flip E1272, разблокированный, 100% оригинал, две Sim-карты, GSM, 2G, Bluetooth, FM радио, бесплатная доставка	26 продано	3 570,32 - 3 804,61 руб.	//aliexpress.ru/item/4000317541500.html?algo_pvid=379ccd46-835d-48bb-a742-8cc9b93532bc&algo_expid=379ccd46-835d-48bb-a742-8cc9b93532bc-8&btsid=0b0a182b16006796278531579e5846&ws_ab_test=searchweb0_0,searchweb201602_,searchweb201603_
32903032382	Оригинальный мобильный телефон Nokia 6233, 3G камера, Bluetooth, MP3, оригинальный, разблокированный, бесплатная доставка, 6233	9 продано	2 259,57 - 2 876,03 руб.	//aliexpress.ru/item/32903032382.html?algo_pvid=379ccd46-835d-48bb-a742-8cc9b93532bc&algo_expid=379ccd46-835d-48bb-a742-8cc9b93532bc-9&btsid=0b0a182b16006796278531579e5846&ws_ab_test=searchweb0_0,searchweb201602_,searchweb201603_
4000823546592	Оригинальный разблокированный сотовый телефон Sony Ericsson W705, 3G, Wi-Fi, FM-радио, Bluetooth, GSM, Восстановленный слайдер, мобильный телефон, бесплатная до...	6 продано	2 947,64 - 3 914,36 руб.	//aliexpress.ru/item/4000823546592.html?algo_pvid=379ccd46-835d-48bb-a742-8cc9b93532bc&algo_expid=379ccd46-835d-48bb-a742-8cc9b93532bc-10&btsid=0b0a182b16006796278531579e5846&ws_ab_test=searchweb0_0,searchweb201602_,searchweb201603_
32676726412	Nokia Lumia 640 & Lumia 640XL смартфон с 5-дюймовым дисплеем, четырёхъядерным процессором, ОЗУ 8 Гб, ПЗУ 1 ГБ, 8 МП	12 продано	3 104,87 - 5 105,24 руб.	//aliexpress.ru/item/32676726412.html?algo_pvid=379ccd46-835d-48bb-a742-8cc9b93532bc&algo_expid=379ccd46-835d-48bb-a742-8cc9b93532bc-11&btsid=0b0a182b16006796278531579e5846&ws_ab_test=searchweb0_0,searchweb201602_,searchweb201603_
