id	description	number_of_orders	price	url
4001042741823	Защитный экран для iPhone 11 Pro X XS Max XR, закаленное стекло с защитой от шпионов, для iPhone 8 7 6 6S Plus 5 5S SE 2020	906 продано	77,06 - 122,21 руб.	//aliexpress.ru/item/4001042741823.html?algo_pvid=45ea221b-0aa3-4f60-8d35-51a9cb603216&algo_expid=45ea221b-0aa3-4f60-8d35-51a9cb603216-57&btsid=0b0a182b16006814397135033e5846&ws_ab_test=searchweb0_0,searchweb201602_,searchweb201603_
32878081997	Tongdaytech веб-камера крышка затвора Магнитный слайдер металлический ультра тонкий чехол для камеры для веб-камеры телефона ПК объектива ноутб...	2838 продано	71,61 - 197,71 руб.	//aliexpress.ru/item/32878081997.html?algo_pvid=45ea221b-0aa3-4f60-8d35-51a9cb603216&algo_expid=45ea221b-0aa3-4f60-8d35-51a9cb603216-58&btsid=0b0a182b16006814397135033e5846&ws_ab_test=searchweb0_0,searchweb201602_,searchweb201603_
4001172893765	Защитная пленка для экрана смартфона, чехол для ZTE Blade, закаленное стекло, переднее стекло A3 2020 9H A 3	44 продано	95,74 руб.	//aliexpress.ru/item/4001172893765.html?algo_pvid=45ea221b-0aa3-4f60-8d35-51a9cb603216&algo_expid=45ea221b-0aa3-4f60-8d35-51a9cb603216-59&btsid=0b0a182b16006814397135033e5846&ws_ab_test=searchweb0_0,searchweb201602_,searchweb201603_
4001254323554	iONCT 15W Qi Беспроводные зарядные устройства для iPhone 11 Pro Xs Max X Xr 8, Индукционная быстрая беспроводная зарядка для Samsung S7 S8 S9 S10 S20 Xiaomi mi 9 беспроводн...	329 продано	306,68 - 412,53 руб.	//aliexpress.ru/item/4001254323554.html?algo_pvid=c6e3f0f0-4af2-4dc7-bb99-90e8e4495a94&algo_expid=c6e3f0f0-4af2-4dc7-bb99-90e8e4495a94-0&btsid=0b0a182b16006814696265916e5846&ws_ab_test=searchweb0_0,searchweb201602_,searchweb201603_
4001189474110	Гидрогелевая пленка для iPhone 11 Pro Max, защитная пленка для экрана 11Pro Max 11 Max Pro, мягкая пленка 6 6S 8 Plus X XS Max Se 2020, не стекло	581 продано	79,40 - 159,57 руб.	//aliexpress.ru/item/4001189474110.html?algo_pvid=c6e3f0f0-4af2-4dc7-bb99-90e8e4495a94&algo_expid=c6e3f0f0-4af2-4dc7-bb99-90e8e4495a94-2&btsid=0b0a182b16006814696265916e5846&ws_ab_test=searchweb0_0,searchweb201602_,searchweb201603_
32964083309	Brassard телефон спортивный для Samsung iPhone xs max x xr 7 8 6s 6 plus, чехол для упражнений, браслет для бега, наручный ремень, аксессуары для телефона	690 продано	199,26 руб.	//aliexpress.ru/item/32964083309.html?algo_pvid=c6e3f0f0-4af2-4dc7-bb99-90e8e4495a94&algo_expid=c6e3f0f0-4af2-4dc7-bb99-90e8e4495a94-3&btsid=0b0a182b16006814696265916e5846&ws_ab_test=searchweb0_0,searchweb201602_,searchweb201603_
4000595048455	Защитное стекло 2-в-1 для samsung galaxy a51, a71, 2019, a, 51, 71, 51a, 71a, a515F, a715F, закаленное стекло для защиты экрана, пленка	10525 продано	129,99 руб.	//aliexpress.ru/item/4000595048455.html?algo_pvid=c6e3f0f0-4af2-4dc7-bb99-90e8e4495a94&algo_expid=c6e3f0f0-4af2-4dc7-bb99-90e8e4495a94-4&btsid=0b0a182b16006814696265916e5846&ws_ab_test=searchweb0_0,searchweb201602_,searchweb201603_
33032736485	Передняя и задняя 3D Защитная пленка для экрана, защитная пленка из ТПУ для Xiaomi Redmi K20 Pro, мягкая прозрачная Гидрогелевая пленка для Xiaomi Mi 9T Pro	12 продано	146,34 руб.	//aliexpress.ru/item/33032736485.html?algo_pvid=c6e3f0f0-4af2-4dc7-bb99-90e8e4495a94&algo_expid=c6e3f0f0-4af2-4dc7-bb99-90e8e4495a94-5&btsid=0b0a182b16006814696265916e5846&ws_ab_test=searchweb0_0,searchweb201602_,searchweb201603_
1005001339222337	Новейшее беспроводное зарядное устройство K8 для iPhone 11 Pro 8 X XR XS Max 10W USB быстрая Беспроводная зарядка Pad для iPhone Samsung Huawei Xiaomi	756 продано	291,89 - 486,48 руб.	//aliexpress.ru/item/1005001339222337.html?algo_pvid=c6e3f0f0-4af2-4dc7-bb99-90e8e4495a94&algo_expid=c6e3f0f0-4af2-4dc7-bb99-90e8e4495a94-6&btsid=0b0a182b16006814696265916e5846&ws_ab_test=searchweb0_0,searchweb201602_,searchweb201603_
4000943277207	Полностью изогнутая матовая Гидрогелевая пленка для Samsung Galaxy S20 Ultra S20 S10 S9 S8 Note 20 10 9 8 Plus защита для экрана против отпечатков пальцев	1260 продано	126,10 руб.	//aliexpress.ru/item/4000943277207.html?algo_pvid=c6e3f0f0-4af2-4dc7-bb99-90e8e4495a94&algo_expid=c6e3f0f0-4af2-4dc7-bb99-90e8e4495a94-7&btsid=0b0a182b16006814696265916e5846&ws_ab_test=searchweb0_0,searchweb201602_,searchweb201603_
4001012024292	Беспроводное зарядное устройство Qi 10 Вт 7,5 Вт для Apple iPhone 11 Pro Max X XR XS Max 8 Plus, iPhone SE 2020 SE2	150 продано	699,75 руб.	//aliexpress.ru/item/4001012024292.html?algo_pvid=c6e3f0f0-4af2-4dc7-bb99-90e8e4495a94&algo_expid=c6e3f0f0-4af2-4dc7-bb99-90e8e4495a94-8&btsid=0b0a182b16006814696265916e5846&ws_ab_test=searchweb0_0,searchweb201602_,searchweb201603_
4000307350737	Для iPhone X XS MAX XR Seconds Change 11 PRO, для Apple iPhone 11Pro MAX, наклейка на объектив, модифицированный чехол для камеры, титановый сплав 10	11 продано	151,78 руб.	//aliexpress.ru/item/4000307350737.html?algo_pvid=c6e3f0f0-4af2-4dc7-bb99-90e8e4495a94&algo_expid=c6e3f0f0-4af2-4dc7-bb99-90e8e4495a94-9&btsid=0b0a182b16006814696265916e5846&ws_ab_test=searchweb0_0,searchweb201602_,searchweb201603_
4001231556375	Быстро раскупаемый 1 шт. белый 3,5 мм с разъемом подачи внешнего сигнала AUX разветвитель кабеля наушников адаптер 1 Мужской до 2 Женский аудио а...	43 продано	42,81 руб.	//aliexpress.ru/item/4001231556375.html?algo_pvid=c6e3f0f0-4af2-4dc7-bb99-90e8e4495a94&algo_expid=c6e3f0f0-4af2-4dc7-bb99-90e8e4495a94-10&btsid=0b0a182b16006814696265916e5846&ws_ab_test=searchweb0_0,searchweb201602_,searchweb201603_
4001159634480	3,5 мм Компьютерная гарнитура, кабель для переоборудования наушников, микрофон, аудио сплиттер, кабель для смартфона к ПК, адаптеры-конвертер...	84 продано	43,59 - 155,68 руб.	//aliexpress.ru/item/4001159634480.html?algo_pvid=c6e3f0f0-4af2-4dc7-bb99-90e8e4495a94&algo_expid=c6e3f0f0-4af2-4dc7-bb99-90e8e4495a94-11&btsid=0b0a182b16006814696265916e5846&ws_ab_test=searchweb0_0,searchweb201602_,searchweb201603_
4000626845238	Защитное стекло 2-в-1 для NOKIA 2,2, 3,2, 6,2, 7,2 Дюйма, задняя крышка камеры для nokia2.2, nokia3.2, защитное закаленное стекло, пленка	414 продано	87,96 - 145,56 руб.	//aliexpress.ru/item/4000626845238.html?algo_pvid=c6e3f0f0-4af2-4dc7-bb99-90e8e4495a94&algo_expid=c6e3f0f0-4af2-4dc7-bb99-90e8e4495a94-12&btsid=0b0a182b16006814696265916e5846&ws_ab_test=searchweb0_0,searchweb201602_,searchweb201603_
1005001413075203	2 в 1 взаимный обмен данными между компьютером и периферийными устройствами с Тип с разъемами типа C и 3,5 мм AUX аудио разъем для наушников заря...		76,28 - 78,62 руб.	//aliexpress.ru/item/1005001413075203.html?algo_pvid=c6e3f0f0-4af2-4dc7-bb99-90e8e4495a94&algo_expid=c6e3f0f0-4af2-4dc7-bb99-90e8e4495a94-13&btsid=0b0a182b16006814696265916e5846&ws_ab_test=searchweb0_0,searchweb201602_,searchweb201603_
4001068292042	Защитное стекло 2-в-1 для samsung galaxy a41, Защитная пленка для объектива камеры, защитное покрытие из закаленного стекла для samsung a 41	213 продано	79,40 - 126,88 руб.	//aliexpress.ru/item/4001068292042.html?algo_pvid=c6e3f0f0-4af2-4dc7-bb99-90e8e4495a94&algo_expid=c6e3f0f0-4af2-4dc7-bb99-90e8e4495a94-14&btsid=0b0a182b16006814696265916e5846&ws_ab_test=searchweb0_0,searchweb201602_,searchweb201603_
4001321879389	Двойной USB портативный внешний аккумулятор 20000 мАч 10000 мАч миллиампер Type C Mirco зарядка тонкий внешний аккумулятор повербанк Зарядное устройс...	16 продано	740,22 - 1 039,11 руб.	//aliexpress.ru/item/4001321879389.html?algo_pvid=c6e3f0f0-4af2-4dc7-bb99-90e8e4495a94&algo_expid=c6e3f0f0-4af2-4dc7-bb99-90e8e4495a94-15&btsid=0b0a182b16006814696265916e5846&ws_ab_test=searchweb0_0,searchweb201602_,searchweb201603_
4000443172440	3D закаленное стекло для Lenovo K5 Pro, полноэкранная Защитная пленка для Lenovo K5 Pro	680 продано	129,99 руб.	//aliexpress.ru/item/4000443172440.html?algo_pvid=c6e3f0f0-4af2-4dc7-bb99-90e8e4495a94&algo_expid=c6e3f0f0-4af2-4dc7-bb99-90e8e4495a94-16&btsid=0b0a182b16006814696265916e5846&ws_ab_test=searchweb0_0,searchweb201602_,searchweb201603_
4000307417082	Универсальная кольцевая Светодиодная лампа для селфи, портативная лампа мобильный телефон для объектива для iPhone Xiaomi mi9t Samsung S10 S9, светящаяся...	537 продано	222,61 руб.	//aliexpress.ru/item/4000307417082.html?algo_pvid=c6e3f0f0-4af2-4dc7-bb99-90e8e4495a94&algo_expid=c6e3f0f0-4af2-4dc7-bb99-90e8e4495a94-17&btsid=0b0a182b16006814696265916e5846&ws_ab_test=searchweb0_0,searchweb201602_,searchweb201603_
4000871319358	Полный набор винтов для ремонта iPhone X XS Max XR, полный комплект болтов, запасные ремонтные детали для Iphone	60 продано	93,41 - 119,09 руб.	//aliexpress.ru/item/4000871319358.html?algo_pvid=c6e3f0f0-4af2-4dc7-bb99-90e8e4495a94&algo_expid=c6e3f0f0-4af2-4dc7-bb99-90e8e4495a94-19&btsid=0b0a182b16006814696265916e5846&ws_ab_test=searchweb0_0,searchweb201602_,searchweb201603_
32999400083	Универсальный Водонепроницаемый спортивный нарукавник 5-6 дюймов для iPhone 11 6 7 8 Plus X XS Max XR, чехол для телефона, уличные спортивные повязки для ...	131 продано	115,98 руб.	//aliexpress.ru/item/32999400083.html?algo_pvid=c6e3f0f0-4af2-4dc7-bb99-90e8e4495a94&algo_expid=c6e3f0f0-4af2-4dc7-bb99-90e8e4495a94-20&btsid=0b0a182b16006814696265916e5846&ws_ab_test=searchweb0_0,searchweb201602_,searchweb201603_
4000589332158	Мягкая Гидрогелевая пленка для Samsung Galaxy Watch Active 1 2 44 мм 40 мм Защитная пленка для экрана прозрачная защитная пленка для Active 1 2 R500	257 продано	110,53 - 147,89 руб.	//aliexpress.ru/item/4000589332158.html?algo_pvid=c6e3f0f0-4af2-4dc7-bb99-90e8e4495a94&algo_expid=c6e3f0f0-4af2-4dc7-bb99-90e8e4495a94-22&btsid=0b0a182b16006814696265916e5846&ws_ab_test=searchweb0_0,searchweb201602_,searchweb201603_
4000528704580	Защитное стекло для Nokia 3,1, полноэкранная защита для Nokia X6 X5 2,1 6,1 5,1 Plus 2 3 5 6 2018 7 8 2017, закаленная пленка	160 продано	90,29 - 123,76 руб.	//aliexpress.ru/item/4000528704580.html?algo_pvid=c6e3f0f0-4af2-4dc7-bb99-90e8e4495a94&algo_expid=c6e3f0f0-4af2-4dc7-bb99-90e8e4495a94-23&btsid=0b0a182b16006814696265916e5846&ws_ab_test=searchweb0_0,searchweb201602_,searchweb201603_
4000763783316	USB-устройство для защиты данных, защищенное от кражи устройство для зарядки телефонов и планшетов, мобильный телефон конвертеров	127 продано	43,59 - 94,96 руб.	//aliexpress.ru/item/4000763783316.html?algo_pvid=c6e3f0f0-4af2-4dc7-bb99-90e8e4495a94&algo_expid=c6e3f0f0-4af2-4dc7-bb99-90e8e4495a94-24&btsid=0b0a182b16006814696265916e5846&ws_ab_test=searchweb0_0,searchweb201602_,searchweb201603_
33027657534	Закаленное стекло для Huawei Mate 20 Lite, Защитная пленка для экрана с полным покрытием	221 продано	121,43 руб.	//aliexpress.ru/item/33027657534.html?algo_pvid=c6e3f0f0-4af2-4dc7-bb99-90e8e4495a94&algo_expid=c6e3f0f0-4af2-4dc7-bb99-90e8e4495a94-25&btsid=0b0a182b16006814696265916e5846&ws_ab_test=searchweb0_0,searchweb201602_,searchweb201603_
4001007858910	40D оригинальный гидрогель для хуавей Huawei P40 P20 P30 Lite Pro Защита экрана для Huawei Mate 20 Pro P10 Lite защитная пленка гидрогелевая не защитное стекло стака...	600 продано	65,39 - 119,87 руб.	//aliexpress.ru/item/4001007858910.html?algo_pvid=c6e3f0f0-4af2-4dc7-bb99-90e8e4495a94&algo_expid=c6e3f0f0-4af2-4dc7-bb99-90e8e4495a94-27&btsid=0b0a182b16006814696265916e5846&ws_ab_test=searchweb0_0,searchweb201602_,searchweb201603_
4000459959834	2-в-1 honor 20 s Защитное стекло для huawei honor 20 s xonor в стиле 20-х г стекло со шлейфом honor20s mar-lx1h 6,15 ''tremp защитная пленка экрана 9h	2111 продано	87,18 - 128,43 руб.	//aliexpress.ru/item/4000459959834.html?algo_pvid=c6e3f0f0-4af2-4dc7-bb99-90e8e4495a94&algo_expid=c6e3f0f0-4af2-4dc7-bb99-90e8e4495a94-28&btsid=0b0a182b16006814696265916e5846&ws_ab_test=searchweb0_0,searchweb201602_,searchweb201603_
1005001369743761	3 шт. закаленное стекло для Huawei Honor 9 10 Lite 8X Защита экрана для Honor 9x 9A 9C 9S 7A 7C 7S 7X Защитная стеклянная пленка	90 продано	127,66 - 200,82 руб.	//aliexpress.ru/item/1005001369743761.html?algo_pvid=c6e3f0f0-4af2-4dc7-bb99-90e8e4495a94&algo_expid=c6e3f0f0-4af2-4dc7-bb99-90e8e4495a94-29&btsid=0b0a182b16006814696265916e5846&ws_ab_test=searchweb0_0,searchweb201602_,searchweb201603_
4001255409022	Защитное стекло, закаленное стекло для Huawei Honor 9X 9A 9C 9S 8X 8A 8C 8S 9i 10i 20i 20S, 3 шт.	743 продано	152,56 - 198,49 руб.	//aliexpress.ru/item/4001255409022.html?algo_pvid=c6e3f0f0-4af2-4dc7-bb99-90e8e4495a94&algo_expid=c6e3f0f0-4af2-4dc7-bb99-90e8e4495a94-30&btsid=0b0a182b16006814696265916e5846&ws_ab_test=searchweb0_0,searchweb201602_,searchweb201603_
1005001320446894	Матовое закаленное стекло для xiaomi redmi note 8 pro 8t на xiomi redmy 8a 7a not 7 redmi8 a Защитная матовая пленка	18 продано	91,85 - 122,21 руб.	//aliexpress.ru/item/1005001320446894.html?algo_pvid=c6e3f0f0-4af2-4dc7-bb99-90e8e4495a94&algo_expid=c6e3f0f0-4af2-4dc7-bb99-90e8e4495a94-32&btsid=0b0a182b16006814696265916e5846&ws_ab_test=searchweb0_0,searchweb201602_,searchweb201603_
32848482901	Absuhjx 200 шт., винт с нижней резьбой для iPhone 6S 6 Plus 8 X, коннектор для док-станции Torx 5, звездочки, винты, аксессуары, Pentalobe	569 продано	226,51 - 347,15 руб.	//aliexpress.ru/item/32848482901.html?algo_pvid=c6e3f0f0-4af2-4dc7-bb99-90e8e4495a94&algo_expid=c6e3f0f0-4af2-4dc7-bb99-90e8e4495a94-33&btsid=0b0a182b16006814696265916e5846&ws_ab_test=searchweb0_0,searchweb201602_,searchweb201603_
4001166067123	Защитное стекло для Nokia 5,3 дюйма, 4 в 1, закаленное стекло для Nokia 5,3, защита экрана камеры для Nokia 5,3 TA-1234 TA-1223 TA-1227	39 продано	95,74 - 182,14 руб.	//aliexpress.ru/item/4001166067123.html?algo_pvid=c6e3f0f0-4af2-4dc7-bb99-90e8e4495a94&algo_expid=c6e3f0f0-4af2-4dc7-bb99-90e8e4495a94-34&btsid=0b0a182b16006814696265916e5846&ws_ab_test=searchweb0_0,searchweb201602_,searchweb201603_
4001219038145	9d Защитное стекло для xiaomi poco x3 redmi note 9 pro Защитное стекло для камеры readmi note 9 s 9 s redmy 9a 9c пленка для экрана телефона	260 продано	70,06 - 127,66 руб.	//aliexpress.ru/item/4001219038145.html?algo_pvid=c6e3f0f0-4af2-4dc7-bb99-90e8e4495a94&algo_expid=c6e3f0f0-4af2-4dc7-bb99-90e8e4495a94-35&btsid=0b0a182b16006814696265916e5846&ws_ab_test=searchweb0_0,searchweb201602_,searchweb201603_
1005001290621147	2 шт., полностью клеевое мягкое изогнутое керамическое закаленное стекло для Samsung Galaxy S20 Ultra S10 S9 S8 Note 8 9 10 Plus, Защитная пленка для экрана	162 продано	151,78 - 217,17 руб.	//aliexpress.ru/item/1005001290621147.html?algo_pvid=c6e3f0f0-4af2-4dc7-bb99-90e8e4495a94&algo_expid=c6e3f0f0-4af2-4dc7-bb99-90e8e4495a94-36&btsid=0b0a182b16006814696265916e5846&ws_ab_test=searchweb0_0,searchweb201602_,searchweb201603_
4001017489663	3D изогнутое полное покрытие закаленное стекло для oneplus 8 Защитное стекло для OnePlus 8 pro 8pro one plus 8 Защита экрана	89 продано	153,34 руб.	//aliexpress.ru/item/4001017489663.html?algo_pvid=c6e3f0f0-4af2-4dc7-bb99-90e8e4495a94&algo_expid=c6e3f0f0-4af2-4dc7-bb99-90e8e4495a94-37&btsid=0b0a182b16006814696265916e5846&ws_ab_test=searchweb0_0,searchweb201602_,searchweb201603_
32843437326	Полноэкранное закаленное стекло 9H для Asus Zenfone 4 Max 5,2 ZC520KL X00ED X00EDA X00EDB, защитная пленка	51 продано	119,87 руб.	//aliexpress.ru/item/32843437326.html?algo_pvid=c6e3f0f0-4af2-4dc7-bb99-90e8e4495a94&algo_expid=c6e3f0f0-4af2-4dc7-bb99-90e8e4495a94-38&btsid=0b0a182b16006814696265916e5846&ws_ab_test=searchweb0_0,searchweb201602_,searchweb201603_
4000760548331	Стеклянная Защитная камера 2 в 1 orro a5 2020, Защитное стекло для oppo a5 2020, защитная броня для oppo a5 opo a 5 2020 a52020 6,5 дюйма	321 продано	84,85 - 128,43 руб.	//aliexpress.ru/item/4000760548331.html?algo_pvid=c6e3f0f0-4af2-4dc7-bb99-90e8e4495a94&algo_expid=c6e3f0f0-4af2-4dc7-bb99-90e8e4495a94-39&btsid=0b0a182b16006814696265916e5846&ws_ab_test=searchweb0_0,searchweb201602_,searchweb201603_
4001114864674	Универсальный держатель для телефона для занятий спортом на открытом воздухе, чехол на руку для Samsung S20 Ultra Gym, сумка для бега, чехол для iPhone X 11...	7 продано	130,77 руб.	//aliexpress.ru/item/4001114864674.html?algo_pvid=c6e3f0f0-4af2-4dc7-bb99-90e8e4495a94&algo_expid=c6e3f0f0-4af2-4dc7-bb99-90e8e4495a94-40&btsid=0b0a182b16006814696265916e5846&ws_ab_test=searchweb0_0,searchweb201602_,searchweb201603_
4000780225914	Защитное стекло для vivo Y11, закаленное стекло с полным покрытием, 2 в 1, Защитная пленка для объектива камеры Vivo y11 vivo y 11 Y 11, 2019	666 продано	72,39 - 137 руб.	//aliexpress.ru/item/4000780225914.html?algo_pvid=c6e3f0f0-4af2-4dc7-bb99-90e8e4495a94&algo_expid=c6e3f0f0-4af2-4dc7-bb99-90e8e4495a94-41&btsid=0b0a182b16006814696265916e5846&ws_ab_test=searchweb0_0,searchweb201602_,searchweb201603_
4000070761332	"Закаленное стекло для Honor 6C 5C 4C Pro 3C твердое Защитное стекло для Huawei Honor 6A 4A 3A 5A 5,5 ""5A Europe 5,0"" Защита экрана"	2665 продано	51,38 - 125,32 руб.	//aliexpress.ru/item/4000070761332.html?algo_pvid=c6e3f0f0-4af2-4dc7-bb99-90e8e4495a94&algo_expid=c6e3f0f0-4af2-4dc7-bb99-90e8e4495a94-42&btsid=0b0a182b16006814696265916e5846&ws_ab_test=searchweb0_0,searchweb201602_,searchweb201603_
4000246568007	Кабель с разъемом Usb типа C для 3,5 мм Aux адаптер для наушников Usb Type-C разъем аудио кабель для Oneplus 7t 8 Samsung S20 Plus Ultra Google Pixel 4	1093 продано	73,17 - 147,11 руб.	//aliexpress.ru/item/4000246568007.html?algo_pvid=c6e3f0f0-4af2-4dc7-bb99-90e8e4495a94&algo_expid=c6e3f0f0-4af2-4dc7-bb99-90e8e4495a94-43&btsid=0b0a182b16006814696265916e5846&ws_ab_test=searchweb0_0,searchweb201602_,searchweb201603_
32908369257	TOKOHANSUN Usb зарядка селфи кольцо Светодиодная лампа для телефона мобильный телефон объектив Led Sefie лампа кольцо вспышка линзы для Iphone Samsung	1339 продано	572,10 руб.	//aliexpress.ru/item/32908369257.html?algo_pvid=c6e3f0f0-4af2-4dc7-bb99-90e8e4495a94&algo_expid=c6e3f0f0-4af2-4dc7-bb99-90e8e4495a94-45&btsid=0b0a182b16006814696265916e5846&ws_ab_test=searchweb0_0,searchweb201602_,searchweb201603_
32781201345	Матовая защитная пленка из закаленного стекла премиум класса для iPhone Xs Max 5S 5C 6 6S 7 8 Plus	459 продано	92,63 - 132,33 руб.	//aliexpress.ru/item/32781201345.html?algo_pvid=c6e3f0f0-4af2-4dc7-bb99-90e8e4495a94&algo_expid=c6e3f0f0-4af2-4dc7-bb99-90e8e4495a94-47&btsid=0b0a182b16006814696265916e5846&ws_ab_test=searchweb0_0,searchweb201602_,searchweb201603_
4000769666121	Новый универсальный приемник беспроводной зарядки USB Type-CAndroid Micro Qi, беспроводное зарядное устройство, зарядная подставка, модуль на мобильн...	104 продано	102,75 - 154,12 руб.	//aliexpress.ru/item/4000769666121.html?algo_pvid=c6e3f0f0-4af2-4dc7-bb99-90e8e4495a94&algo_expid=c6e3f0f0-4af2-4dc7-bb99-90e8e4495a94-48&btsid=0b0a182b16006814696265916e5846&ws_ab_test=searchweb0_0,searchweb201602_,searchweb201603_
4000048491868	Защитное стекло, закаленное стекло для Huawei Honor 10, 2 шт.	2546 продано	78,62 - 133,88 руб.	//aliexpress.ru/item/4000048491868.html?algo_pvid=c6e3f0f0-4af2-4dc7-bb99-90e8e4495a94&algo_expid=c6e3f0f0-4af2-4dc7-bb99-90e8e4495a94-49&btsid=0b0a182b16006814696265916e5846&ws_ab_test=searchweb0_0,searchweb201602_,searchweb201603_
4000326829769	Защитное стекло для экрана iphone 7 8 plus, Защитная пленка для iphone 7plus 8 plus, закаленное стекло i7 i8, iphone7plus, пленка для телефона 1, 2, 3 шт.	1951 продано	105,86 - 152,56 руб.	//aliexpress.ru/item/4000326829769.html?algo_pvid=c6e3f0f0-4af2-4dc7-bb99-90e8e4495a94&algo_expid=c6e3f0f0-4af2-4dc7-bb99-90e8e4495a94-50&btsid=0b0a182b16006814696265916e5846&ws_ab_test=searchweb0_0,searchweb201602_,searchweb201603_
32924066100	Для Huawei Honor 10 закаленное стекло полное покрытие защита экрана Honor 10 стекло защитное стекло Honor 10 пленка на Honor 20 Pro Lite	7311 продано	92,63 - 99,63 руб.	//aliexpress.ru/item/32924066100.html?algo_pvid=c6e3f0f0-4af2-4dc7-bb99-90e8e4495a94&algo_expid=c6e3f0f0-4af2-4dc7-bb99-90e8e4495a94-52&btsid=0b0a182b16006814696265916e5846&ws_ab_test=searchweb0_0,searchweb201602_,searchweb201603_
4001350876313	KLMAG1JENB-B041 KLMBG2JETD-B041 KLMBG2JENB-B041 KLMCG2KETM-B041 KLMDG4UCTA-B041 KMSJS000KM-B308 KLMCG4JENB-B041		467,02 - 1 673,47 руб.	//aliexpress.ru/item/4001350876313.html?algo_pvid=c6e3f0f0-4af2-4dc7-bb99-90e8e4495a94&algo_expid=c6e3f0f0-4af2-4dc7-bb99-90e8e4495a94-53&btsid=0b0a182b16006814696265916e5846&ws_ab_test=searchweb0_0,searchweb201602_,searchweb201603_
4001039544265	Защитное стекло для honor 9 c, 1, 2, 3 шт., Защитное стекло для huawei honor 9c, Защита экрана для honor 9c, onor, c9, 6,39, steklo, дюйма	295 продано	89,52 - 150,23 руб.	//aliexpress.ru/item/4001039544265.html?algo_pvid=c6e3f0f0-4af2-4dc7-bb99-90e8e4495a94&algo_expid=c6e3f0f0-4af2-4dc7-bb99-90e8e4495a94-55&btsid=0b0a182b16006814696265916e5846&ws_ab_test=searchweb0_0,searchweb201602_,searchweb201603_
4001207346325	Usb-кабель для зарядки часов магнитное Беспроводное зарядное устройство QI Беспроводная зарядка док-станция для Apple Iphone наручных часов IWatch се...	1096 продано	228,06 руб.	//aliexpress.ru/item/4001207346325.html?algo_pvid=c6e3f0f0-4af2-4dc7-bb99-90e8e4495a94&algo_expid=c6e3f0f0-4af2-4dc7-bb99-90e8e4495a94-56&btsid=0b0a182b16006814696265916e5846&ws_ab_test=searchweb0_0,searchweb201602_,searchweb201603_
4000756444362	Защитная пленка 600D с изогнутыми краями для Oneplus 7 Pro 5 6T 6 5T Pro, Гидрогелевая пленка для One plus 7T, полная защитная пленка, не стекло	2933 продано	77,06 - 231,96 руб.	//aliexpress.ru/item/4000756444362.html?algo_pvid=c6e3f0f0-4af2-4dc7-bb99-90e8e4495a94&algo_expid=c6e3f0f0-4af2-4dc7-bb99-90e8e4495a94-57&btsid=0b0a182b16006814696265916e5846&ws_ab_test=searchweb0_0,searchweb201602_,searchweb201603_
