id	description	number_of_orders	price	url
4001264980489	9D закаленное стекло для Huawei P40 Lite E P Smart Z 2019 Защитное стекло для экрана для Huawei Mate 30 20 10 Lite 20X пленка	665 продано	70,06 - 75,51 руб.	//aliexpress.ru/item/4001264980489.html?algo_pvid=fc77c365-c9bc-42c0-93e4-0fc313f1b662&algo_expid=fc77c365-c9bc-42c0-93e4-0fc313f1b662-18&btsid=0b0a182b16006811544996111e5846&ws_ab_test=searchweb0_0,searchweb201602_,searchweb201603_
4001216331152	30000mAh мини банк силы двойной USB зарядка цифровой дисплей для Samsung Xiaomi Iphone внешний аккумулятор портативное зарядное устройство	48 продано	536,29 руб.	//aliexpress.ru/item/4001216331152.html?s=p&ad_pvid=2020092102391413251416387726920000046073_113&algo_pvid=fc77c365-c9bc-42c0-93e4-0fc313f1b662&algo_expid=fc77c365-c9bc-42c0-93e4-0fc313f1b662-19&btsid=0b0a182b16006811544996111e5846&ws_ab_test=searchweb0_0,searchweb201602_,searchweb201603_
4001308158584	1-3 шт закаленное стекло для OnePlus Nord защита экрана 9H Защитная пленка для телефона для OnePlus 8/OnePlus Z Закаленное стекло пленка	41 продано	108,20 - 147,11 руб.	//aliexpress.ru/item/4001308158584.html?algo_pvid=fc77c365-c9bc-42c0-93e4-0fc313f1b662&algo_expid=fc77c365-c9bc-42c0-93e4-0fc313f1b662-20&btsid=0b0a182b16006811544996111e5846&ws_ab_test=searchweb0_0,searchweb201602_,searchweb201603_
4000340806028	2 в 1, широкоугольный объектив 0,45x + 12,5x макрообъектив, профессиональный HD объектив для камеры телефона iPhone 8 7 6S Plus Xiaomi Samsung LG	1613 продано	323,80 руб.	//aliexpress.ru/item/4000340806028.html?algo_pvid=fc77c365-c9bc-42c0-93e4-0fc313f1b662&algo_expid=fc77c365-c9bc-42c0-93e4-0fc313f1b662-21&btsid=0b0a182b16006811544996111e5846&ws_ab_test=searchweb0_0,searchweb201602_,searchweb201603_
4000529328769	9H закаленное стекло для Oneplus 6T 6 3T 5 5T 7 стекло для One plus three 1 + 6T 1 + 5T 1 + 6 1 + 5 1 + 1 + 7 Защитное стекло для экрана стекло защитная пленка для экрана	1145 продано	50,60 - 128,43 руб.	//aliexpress.ru/item/4000529328769.html?algo_pvid=fc77c365-c9bc-42c0-93e4-0fc313f1b662&algo_expid=fc77c365-c9bc-42c0-93e4-0fc313f1b662-22&btsid=0b0a182b16006811544996111e5846&ws_ab_test=searchweb0_0,searchweb201602_,searchweb201603_
1005001438123520	GENAI Беспроводное зарядное устройство 5 Вт 10 Вт 15 Вт Qi Быстрое беспроводное зарядное устройство автоматическое переключение напряжения для ...		1 659,46 руб.	//aliexpress.ru/item/1005001438123520.html?s=p&ad_pvid=2020092102391413251416387726920000046073_114&algo_pvid=fc77c365-c9bc-42c0-93e4-0fc313f1b662&algo_expid=fc77c365-c9bc-42c0-93e4-0fc313f1b662-24&btsid=0b0a182b16006811544996111e5846&ws_ab_test=searchweb0_0,searchweb201602_,searchweb201603_
4001321583528	Матовое мягкое керамическое закаленное стекло для Xiaomi Mi 9 SE 9T Redmi Note 8 7 9 s 8T Pro Mi 10 Lite K20 K30 Защитная пленка для экрана	269 продано	96,52 - 154,90 руб.	//aliexpress.ru/item/4001321583528.html?algo_pvid=fc77c365-c9bc-42c0-93e4-0fc313f1b662&algo_expid=fc77c365-c9bc-42c0-93e4-0fc313f1b662-25&btsid=0b0a182b16006811544996111e5846&ws_ab_test=searchweb0_0,searchweb201602_,searchweb201603_
10000405816045	Закаленное стекло 10D для iPhone 11 Pro Max XS XR X 8 7 6 6S Plus, полное изогнутое стекло, защита от отпечатков пальцев для SE 2020	125 продано	51,38 - 80,18 руб.	//aliexpress.ru/item/10000405816045.html?algo_pvid=fc77c365-c9bc-42c0-93e4-0fc313f1b662&algo_expid=fc77c365-c9bc-42c0-93e4-0fc313f1b662-26&btsid=0b0a182b16006811544996111e5846&ws_ab_test=searchweb0_0,searchweb201602_,searchweb201603_
4000990232086	Защитное стекло для камеры для Honor 30 30s 20 s, защита для экрана, закаленное стекло на Honor 20 pro 30s 20 s 20lite 6,15, защитное стекло	598 продано	72,39 - 112,09 руб.	//aliexpress.ru/item/4000990232086.html?algo_pvid=fc77c365-c9bc-42c0-93e4-0fc313f1b662&algo_expid=fc77c365-c9bc-42c0-93e4-0fc313f1b662-28&btsid=0b0a182b16006811544996111e5846&ws_ab_test=searchweb0_0,searchweb201602_,searchweb201603_
1005001450233082	GENAI Беспроводное зарядное устройство 5 Вт 10 Вт 15 Вт Быстрое беспроводное зарядное устройство автоматическое переключение напряжения для ...		1 010,31 руб.	//aliexpress.ru/item/1005001450233082.html?s=p&ad_pvid=2020092102391413251416387726920000046073_115&algo_pvid=fc77c365-c9bc-42c0-93e4-0fc313f1b662&algo_expid=fc77c365-c9bc-42c0-93e4-0fc313f1b662-29&btsid=0b0a182b16006811544996111e5846&ws_ab_test=searchweb0_0,searchweb201602_,searchweb201603_
4001277209290	Закаленное стекло для OPPO Reno 2 2Z 2F Защита экрана для OPPO Reno A Ace защитная пленка, стекло для Reno Z Neo 10X Zoom 5G		75,51 - 116,76 руб.	//aliexpress.ru/item/4001277209290.html?algo_pvid=fc77c365-c9bc-42c0-93e4-0fc313f1b662&algo_expid=fc77c365-c9bc-42c0-93e4-0fc313f1b662-30&btsid=0b0a182b16006811544996111e5846&ws_ab_test=searchweb0_0,searchweb201602_,searchweb201603_
4000300584634	Адаптер 3 в 1 USB c к type-C, зарядный кабель USB Type c, зарядное устройство, преобразователь для наушников Xiaomi mi 8 mi 6, адаптер для наушников	250 продано	73,95 руб.	//aliexpress.ru/item/4000300584634.html?algo_pvid=fc77c365-c9bc-42c0-93e4-0fc313f1b662&algo_expid=fc77c365-c9bc-42c0-93e4-0fc313f1b662-31&btsid=0b0a182b16006811544996111e5846&ws_ab_test=searchweb0_0,searchweb201602_,searchweb201603_
4000565818528	Защитное стекло для экрана Sony X Performance Compact закаленное стекло для Sony XA3 XA2 Ultra XA1 Plus XA 9H HD пленка	130 продано	53,71 - 77,06 руб.	//aliexpress.ru/item/4000565818528.html?algo_pvid=fc77c365-c9bc-42c0-93e4-0fc313f1b662&algo_expid=fc77c365-c9bc-42c0-93e4-0fc313f1b662-32&btsid=0b0a182b16006811544996111e5846&ws_ab_test=searchweb0_0,searchweb201602_,searchweb201603_
4001230478121	Оригинальный беспроводной зарядный адаптер Samsung qi для Galaxy S7 S6 EDGE S8 S9 S10 Plus Note 4 5 для Iphone 8 X XS XR mi 9	215 продано	305,12 - 349,49 руб.	//aliexpress.ru/item/4001230478121.html?algo_pvid=fc77c365-c9bc-42c0-93e4-0fc313f1b662&algo_expid=fc77c365-c9bc-42c0-93e4-0fc313f1b662-33&btsid=0b0a182b16006811544996111e5846&ws_ab_test=searchweb0_0,searchweb201602_,searchweb201603_
1005001298420485	15 Вт Qi Беспроводное зарядное устройство подставка для iPhone SE2 X XS MAX XR 11 Pro 8 Samsung S20 S10 S9 Быстрая Зарядка Док-станция зарядное устройство для теле...	4 продано	838,29 руб.	//aliexpress.ru/item/1005001298420485.html?s=p&ad_pvid=2020092102391413251416387726920000046073_116&algo_pvid=fc77c365-c9bc-42c0-93e4-0fc313f1b662&algo_expid=fc77c365-c9bc-42c0-93e4-0fc313f1b662-34&btsid=0b0a182b16006811544996111e5846&ws_ab_test=searchweb0_0,searchweb201602_,searchweb201603_
4001245344435	Защитное стекло 15D для Huawei honor 30 20 10 Lite 30S 20S 20i, закаленное стекло для Honor View 20 30 V20 V30 V10, пленка	387 продано	71,61 - 77,06 руб.	//aliexpress.ru/item/4001245344435.html?algo_pvid=fc77c365-c9bc-42c0-93e4-0fc313f1b662&algo_expid=fc77c365-c9bc-42c0-93e4-0fc313f1b662-35&btsid=0b0a182b16006811544996111e5846&ws_ab_test=searchweb0_0,searchweb201602_,searchweb201603_
4001211539169	Матовая защитная пленка для экрана, закаленное стекло для Huawei honor 9a 9c 9x premium 8c 8x, 2-1 шт.	209 продано	120,65 - 151,01 руб.	//aliexpress.ru/item/4001211539169.html?algo_pvid=fc77c365-c9bc-42c0-93e4-0fc313f1b662&algo_expid=fc77c365-c9bc-42c0-93e4-0fc313f1b662-36&btsid=0b0a182b16006811544996111e5846&ws_ab_test=searchweb0_0,searchweb201602_,searchweb201603_
4001139047476	Закаленное стекло с полным покрытием для iPhone SE, 2020, Защита экрана для iPhone 11 Pro, Max, X, XR, XS, 6, 6s, 7, 8 Plus, 5, 6, 6, 6, 6, 6, 7, 8 Plus, 5, 9, 2020	833 продано	92,63 - 176,69 руб.	//aliexpress.ru/item/4001139047476.html?algo_pvid=fc77c365-c9bc-42c0-93e4-0fc313f1b662&algo_expid=fc77c365-c9bc-42c0-93e4-0fc313f1b662-37&btsid=0b0a182b16006811544996111e5846&ws_ab_test=searchweb0_0,searchweb201602_,searchweb201603_
4000075251868	Защитное стекло для смартфона Xiaomi Redmi Note 7 6 5 Pro 5A Prime 9H, Защитная пленка для экрана Redmi Note 4X 4 3 2	5600 продано	53,71 - 84,85 руб.	//aliexpress.ru/item/4000075251868.html?algo_pvid=fc77c365-c9bc-42c0-93e4-0fc313f1b662&algo_expid=fc77c365-c9bc-42c0-93e4-0fc313f1b662-38&btsid=0b0a182b16006811544996111e5846&ws_ab_test=searchweb0_0,searchweb201602_,searchweb201603_
1005001468916531	Официальный силиконовый чехол с логотипом для iphone 7 8 6S 6 Plus 11 Pro X XS MAX XR SE, чехол для телефона Apple iphone 7 8 plus X 11	2 продано	49,04 - 289,55 руб.	//aliexpress.ru/item/1005001468916531.html?s=p&ad_pvid=2020092102391413251416387726920000046073_117&algo_pvid=fc77c365-c9bc-42c0-93e4-0fc313f1b662&algo_expid=fc77c365-c9bc-42c0-93e4-0fc313f1b662-39&btsid=0b0a182b16006811544996111e5846&ws_ab_test=searchweb0_0,searchweb201602_,searchweb201603_
4000763727599	100D Защитная пленка для Huawei Honor 9X Premium, Защитная пленка для экрана для Huawei Honor 9X Pro, Гидрогелевая пленка для Huawei P Smart Z	89 продано	98,86 руб.	//aliexpress.ru/item/4000763727599.html?algo_pvid=fc77c365-c9bc-42c0-93e4-0fc313f1b662&algo_expid=fc77c365-c9bc-42c0-93e4-0fc313f1b662-40&btsid=0b0a182b16006811544996111e5846&ws_ab_test=searchweb0_0,searchweb201602_,searchweb201603_
1005001265665646	Закаленное стекло для телефона Philips Xenium S266 9 H 2.5D, Премиум Защитная пленка, чехол, Обложка	53 продано	114,42 руб.	//aliexpress.ru/item/1005001265665646.html?algo_pvid=fc77c365-c9bc-42c0-93e4-0fc313f1b662&algo_expid=fc77c365-c9bc-42c0-93e4-0fc313f1b662-41&btsid=0b0a182b16006811544996111e5846&ws_ab_test=searchweb0_0,searchweb201602_,searchweb201603_
1005001371311877	Комплект объективов для камеры 3 в 1, мобильный телефон, широкоугольный объектив, макрообъектив для IPhone, Xiaomi, Huawei, Lenovo, широкоугольный макрооб...		41,26 - 221,84 руб.	//aliexpress.ru/item/1005001371311877.html?algo_pvid=fc77c365-c9bc-42c0-93e4-0fc313f1b662&algo_expid=fc77c365-c9bc-42c0-93e4-0fc313f1b662-42&btsid=0b0a182b16006811544996111e5846&ws_ab_test=searchweb0_0,searchweb201602_,searchweb201603_
4001041420652	Защитное стекло для huawei p40 lite E, 3 шт., Защитное стекло для huawei p 40 lite p40 light p40lite E p40liteE, защитная пленка для экрана	700 продано	91,85 - 153,34 руб.	//aliexpress.ru/item/4001041420652.html?algo_pvid=fc77c365-c9bc-42c0-93e4-0fc313f1b662&algo_expid=fc77c365-c9bc-42c0-93e4-0fc313f1b662-43&btsid=0b0a182b16006811544996111e5846&ws_ab_test=searchweb0_0,searchweb201602_,searchweb201603_
4001286462895	12 дюймов 3D мобильный телефон экран видео лупа изогнутый увеличенный смартфон кино усиление проектор Стенд кронштейн вечерние сувениры	14 продано	810,27 руб.	//aliexpress.ru/item/4001286462895.html?s=p&ad_pvid=2020092102391413251416387726920000046073_119&algo_pvid=fc77c365-c9bc-42c0-93e4-0fc313f1b662&algo_expid=fc77c365-c9bc-42c0-93e4-0fc313f1b662-44&btsid=0b0a182b16006811544996111e5846&ws_ab_test=searchweb0_0,searchweb201602_,searchweb201603_
10000032208310	Адаптер для наушников SAMSUNG Type-C-3,5 мм AUX, аудиокабель для SAMSUNG NOTE 10 Plus A90 A80 A60 Type C-3,5 Jack	264 продано	195,37 - 242,85 руб.	//aliexpress.ru/item/10000032208310.html?algo_pvid=fc77c365-c9bc-42c0-93e4-0fc313f1b662&algo_expid=fc77c365-c9bc-42c0-93e4-0fc313f1b662-47&btsid=0b0a182b16006811544996111e5846&ws_ab_test=searchweb0_0,searchweb201602_,searchweb201603_
33056863822	Защитное стекло для Huawei Y5 2019, закаленное стекло для Huawei Y6 Y7 Y9 2019, защитная пленка для экрана Y 5 6 7 9 5Y 6Y 7y 9y	583 продано	78,62 руб.	//aliexpress.ru/item/33056863822.html?algo_pvid=fc77c365-c9bc-42c0-93e4-0fc313f1b662&algo_expid=fc77c365-c9bc-42c0-93e4-0fc313f1b662-48&btsid=0b0a182b16006811544996111e5846&ws_ab_test=searchweb0_0,searchweb201602_,searchweb201603_
4001280428412	3 шт./упак. HCAO для iphone SE 2020 защита для экрана из закаленного стекла для iphone 8 сенсорный экран protetectors для iphone 7 сенсорный экран стекло для iphone 6s с...	20 продано	126,10 руб.	//aliexpress.ru/item/4001280428412.html?s=p&ad_pvid=2020092102391413251416387726920000046073_120&algo_pvid=fc77c365-c9bc-42c0-93e4-0fc313f1b662&algo_expid=fc77c365-c9bc-42c0-93e4-0fc313f1b662-49&btsid=0b0a182b16006811544996111e5846&ws_ab_test=searchweb0_0,searchweb201602_,searchweb201603_
32988230103	Защитная пленка для экрана телефона, закаленное стекло для Samsung Galaxy S6 S7 S2, Защитное стекло для Samsung S5 Mini S4 S3 Neo S III	5071 продано	50,60 - 75,51 руб.	//aliexpress.ru/item/32988230103.html?algo_pvid=fc77c365-c9bc-42c0-93e4-0fc313f1b662&algo_expid=fc77c365-c9bc-42c0-93e4-0fc313f1b662-50&btsid=0b0a182b16006811544996111e5846&ws_ab_test=searchweb0_0,searchweb201602_,searchweb201603_
4001127834627	Защитное стекло 9D, закаленное стекло для Huawei Nova 7 6 SE 5 5i 5T 4 4E 3 3i 3T Huawei Nova 7 6 SE	1512 продано	73,95 - 106,64 руб.	//aliexpress.ru/item/4001127834627.html?algo_pvid=fc77c365-c9bc-42c0-93e4-0fc313f1b662&algo_expid=fc77c365-c9bc-42c0-93e4-0fc313f1b662-51&btsid=0b0a182b16006811544996111e5846&ws_ab_test=searchweb0_0,searchweb201602_,searchweb201603_
4000570949437	Закаленное стекло для LG K50S K50 K40S K40 K30 2019 Защитное стекло для экрана LG K20 Plus K11 K10 Pro 2018	476 продано	53,71 - 131,55 руб.	//aliexpress.ru/item/4000570949437.html?algo_pvid=fc77c365-c9bc-42c0-93e4-0fc313f1b662&algo_expid=fc77c365-c9bc-42c0-93e4-0fc313f1b662-52&btsid=0b0a182b16006811544996111e5846&ws_ab_test=searchweb0_0,searchweb201602_,searchweb201603_
4001277374982	Защитное стекло, закаленное стекло HD для Samsung Galaxy J2 Core/J4/J6 Plus/J8 2018/111D	25 продано	58,38 - 75,51 руб.	//aliexpress.ru/item/4001277374982.html?algo_pvid=fc77c365-c9bc-42c0-93e4-0fc313f1b662&algo_expid=fc77c365-c9bc-42c0-93e4-0fc313f1b662-53&btsid=0b0a182b16006811544996111e5846&ws_ab_test=searchweb0_0,searchweb201602_,searchweb201603_
4001279495353	15 Вт Беспроводное зарядное устройство 3 в 1 быстрая зарядка подставка для iPhone 11Pro 8 X XS Apple Watch Series 5 4 3 Airpods Pro 1 2 Беспроводная зарядка	99 продано	1 893,75 руб.	//aliexpress.ru/item/4001279495353.html?s=p&ad_pvid=2020092102391413251416387726920000046073_121&algo_pvid=fc77c365-c9bc-42c0-93e4-0fc313f1b662&algo_expid=fc77c365-c9bc-42c0-93e4-0fc313f1b662-54&btsid=0b0a182b16006811544996111e5846&ws_ab_test=searchweb0_0,searchweb201602_,searchweb201603_
10000286633165	Защитное стекло для камеры A71, 2 шт., для Samsung Galaxy a51, a, 71, 51	378 продано	73,17 - 94,19 руб.	//aliexpress.ru/item/10000286633165.html?algo_pvid=fc77c365-c9bc-42c0-93e4-0fc313f1b662&algo_expid=fc77c365-c9bc-42c0-93e4-0fc313f1b662-55&btsid=0b0a182b16006811544996111e5846&ws_ab_test=searchweb0_0,searchweb201602_,searchweb201603_
4000010925027	Переходник с 8 штырьков на 30 штырьков для Iphone 4, iPad 2, 3, iPad Touch3, 4, M5TB	245 продано	67,72 руб.	//aliexpress.ru/item/4000010925027.html?algo_pvid=fc77c365-c9bc-42c0-93e4-0fc313f1b662&algo_expid=fc77c365-c9bc-42c0-93e4-0fc313f1b662-57&btsid=0b0a182b16006811544996111e5846&ws_ab_test=searchweb0_0,searchweb201602_,searchweb201603_
4001096401712	8-контактный кабель с разъемом Lightning для адаптера Micro USB, для Samsung, Xiaomi, Huawei, Android, сотового телефона, планшетного ПК	132 продано	73,17 руб.	//aliexpress.ru/item/4001096401712.html?algo_pvid=fc77c365-c9bc-42c0-93e4-0fc313f1b662&algo_expid=fc77c365-c9bc-42c0-93e4-0fc313f1b662-58&btsid=0b0a182b16006811544996111e5846&ws_ab_test=searchweb0_0,searchweb201602_,searchweb201603_
4000010925027	Переходник с 8 штырьков на 30 штырьков для Iphone 4, iPad 2, 3, iPad Touch3, 4, M5TB	245 продано	67,72 руб.	//aliexpress.ru/item/4000010925027.html?algo_pvid=67d54fa7-9ddc-434d-820b-2cce354df2f6&algo_expid=67d54fa7-9ddc-434d-820b-2cce354df2f6-0&btsid=0b0a182b16006811937637002e5846&ws_ab_test=searchweb0_0,searchweb201602_,searchweb201603_
4001096401712	8-контактный кабель с разъемом Lightning для адаптера Micro USB, для Samsung, Xiaomi, Huawei, Android, сотового телефона, планшетного ПК	132 продано	73,17 руб.	//aliexpress.ru/item/4001096401712.html?algo_pvid=67d54fa7-9ddc-434d-820b-2cce354df2f6&algo_expid=67d54fa7-9ddc-434d-820b-2cce354df2f6-1&btsid=0b0a182b16006811937637002e5846&ws_ab_test=searchweb0_0,searchweb201602_,searchweb201603_
4000768080412	Ледяная поверхность для iPhone 7 8 X XS XR, задняя пленка, тонкая защитная пленка для экрана, защитные наклейки, цветные наклейки, задняя декоративн...	1051 продано	66,94 - 74,73 руб.	//aliexpress.ru/item/4000768080412.html?algo_pvid=67d54fa7-9ddc-434d-820b-2cce354df2f6&algo_expid=67d54fa7-9ddc-434d-820b-2cce354df2f6-2&btsid=0b0a182b16006811937637002e5846&ws_ab_test=searchweb0_0,searchweb201602_,searchweb201603_
32922915271	20000 мАч ROMOSS LT20 внешний аккумулятор Dual USB Внешний аккумулятор со светодиодным дисплеем быстрое портативное зарядное устройство для Xiaomi для ...	5705 продано	1 244,60 - 1 594,86 руб.	//aliexpress.ru/item/32922915271.html?algo_pvid=67d54fa7-9ddc-434d-820b-2cce354df2f6&algo_expid=67d54fa7-9ddc-434d-820b-2cce354df2f6-3&btsid=0b0a182b16006811937637002e5846&ws_ab_test=searchweb0_0,searchweb201602_,searchweb201603_
4001218923889	80000mAh внешний аккумулятор беспроводной Солнечный аккумулятор светодиодный свет повербанк Портативный 4 USB телефон быстрое зарядное устройс...	388 продано	1 303,75 руб.	//aliexpress.ru/item/4001218923889.html?s=p&ad_pvid=20200921023954492309359538070000095404_123&algo_pvid=67d54fa7-9ddc-434d-820b-2cce354df2f6&algo_expid=67d54fa7-9ddc-434d-820b-2cce354df2f6-4&btsid=0b0a182b16006811937637002e5846&ws_ab_test=searchweb0_0,searchweb201602_,searchweb201603_
1005001264775671	HD Защитное стекло для ZTE Blade V10 Vita Гидрогелевая пленка для ZTE Blade 10 A7 Prime Axon 11 5G Защитная пленка для экрана	31 продано	99,63 руб.	//aliexpress.ru/item/1005001264775671.html?algo_pvid=67d54fa7-9ddc-434d-820b-2cce354df2f6&algo_expid=67d54fa7-9ddc-434d-820b-2cce354df2f6-5&btsid=0b0a182b16006811937637002e5846&ws_ab_test=searchweb0_0,searchweb201602_,searchweb201603_
4001201112245	Защитное стекло для huawei honor 9c, Защитное стекло для honor 9c, xonor, 9, c, c9, honor 9c, 3D Защитная пленка для экрана, Защитная пленка для экрана, защитная пле...	68 продано	74,73 - 105,86 руб.	//aliexpress.ru/item/4001201112245.html?algo_pvid=67d54fa7-9ddc-434d-820b-2cce354df2f6&algo_expid=67d54fa7-9ddc-434d-820b-2cce354df2f6-6&btsid=0b0a182b16006811937637002e5846&ws_ab_test=searchweb0_0,searchweb201602_,searchweb201603_
4000528785407	5600 мАч портативный внешний аккумулятор чехол внешний мобильный резервный внешний аккумулятор USB Универсальное зарядное устройство адапте...		49,04 - 131,55 руб.	//aliexpress.ru/item/4000528785407.html?algo_pvid=67d54fa7-9ddc-434d-820b-2cce354df2f6&algo_expid=67d54fa7-9ddc-434d-820b-2cce354df2f6-7&btsid=0b0a182b16006811937637002e5846&ws_ab_test=searchweb0_0,searchweb201602_,searchweb201603_
4000864634295	Защита экрана из закаленного стекла для iPhone 6, 7, 8, 6S Plus, X, XR, XS, Противоударная защитная пленка, черное переднее стекло	244 продано	122,21 - 152,56 руб.	//aliexpress.ru/item/4000864634295.html?algo_pvid=67d54fa7-9ddc-434d-820b-2cce354df2f6&algo_expid=67d54fa7-9ddc-434d-820b-2cce354df2f6-8&btsid=0b0a182b16006811937637002e5846&ws_ab_test=searchweb0_0,searchweb201602_,searchweb201603_
4000800652208	Портативное мини-зарядное устройство, 30000 мАч, полноэкранный цифровой дисплей, внешний аккумулятор для быстрой зарядки для Xiaomi Mi iPhone	61 продано	780,70 руб.	//aliexpress.ru/item/4000800652208.html?s=p&ad_pvid=20200921023954492309359538070000095404_124&algo_pvid=67d54fa7-9ddc-434d-820b-2cce354df2f6&algo_expid=67d54fa7-9ddc-434d-820b-2cce354df2f6-9&btsid=0b0a182b16006811937637002e5846&ws_ab_test=searchweb0_0,searchweb201602_,searchweb201603_
4000262351741	Защитное стекло для redmi 8a, закаленное стекло для xiaomi redmi 8a, защитное 3d-стекло для xiomi xaomi redmi8a 8 a a8	103 продано	91,07 руб.	//aliexpress.ru/item/4000262351741.html?algo_pvid=67d54fa7-9ddc-434d-820b-2cce354df2f6&algo_expid=67d54fa7-9ddc-434d-820b-2cce354df2f6-10&btsid=0b0a182b16006811937637002e5846&ws_ab_test=searchweb0_0,searchweb201602_,searchweb201603_
32916786185	Закаленное стекло для Huawei Mate 7, Защитная пленка для экрана, Защитное стекло для Huawei Ascend Mate 7 Mate7, MT7-TL10	27 продано	114,42 руб.	//aliexpress.ru/item/32916786185.html?algo_pvid=67d54fa7-9ddc-434d-820b-2cce354df2f6&algo_expid=67d54fa7-9ddc-434d-820b-2cce354df2f6-11&btsid=0b0a182b16006811937637002e5846&ws_ab_test=searchweb0_0,searchweb201602_,searchweb201603_
4001284216140	Веб-камера крышка затвора Магнитный слайдер пластиковый универсальный антишпионский чехол для камеры для веб-ноутбука iPhone iPad ПК Macbook планш...	125 продано	48,26 - 126,10 руб.	//aliexpress.ru/item/4001284216140.html?algo_pvid=67d54fa7-9ddc-434d-820b-2cce354df2f6&algo_expid=67d54fa7-9ddc-434d-820b-2cce354df2f6-12&btsid=0b0a182b16006811937637002e5846&ws_ab_test=searchweb0_0,searchweb201602_,searchweb201603_
4001256135881	3 в 1 быстрая зарядка Беспроводная зарядная станция Док-станция зарядная подставка для Samsung Galaxy Watch Active Buds AirPods 2 Pro S20 S10 S9	24 продано	1 407,27 - 1 510,02 руб.	//aliexpress.ru/item/4001256135881.html?s=p&ad_pvid=20200921023954492309359538070000095404_125&algo_pvid=67d54fa7-9ddc-434d-820b-2cce354df2f6&algo_expid=67d54fa7-9ddc-434d-820b-2cce354df2f6-14&btsid=0b0a182b16006811937637002e5846&ws_ab_test=searchweb0_0,searchweb201602_,searchweb201603_
4001128211915	2 в 1 Защитное стекло для Samsung A21s 2020 Защита объектива камеры для Samsung Galaxy A 21 s A21s 21 s A217F пленка из закаленного стекла	433 продано	74,73 - 121,43 руб.	//aliexpress.ru/item/4001128211915.html?algo_pvid=67d54fa7-9ddc-434d-820b-2cce354df2f6&algo_expid=67d54fa7-9ddc-434d-820b-2cce354df2f6-15&btsid=0b0a182b16006811937637002e5846&ws_ab_test=searchweb0_0,searchweb201602_,searchweb201603_
