id	description	number_of_orders	price	url
4001251150772	Универсальная 6 ''Водонепроницаемая спортивная сумка с повязкой для бега, бега, тренажерного зала, на руку, мобильный телефон, сумка, чехол, д...		89,52 - 331,58 руб.	//aliexpress.ru/item/4001251150772.html?algo_pvid=1eb8e9b2-9197-47fd-a205-cd04dd20d3d0&algo_expid=1eb8e9b2-9197-47fd-a205-cd04dd20d3d0-41&btsid=0b0a182b16006818218866106e5846&ws_ab_test=searchweb0_0,searchweb201602_,searchweb201603_
4000334256746	Универсальные водонепроницаемые нарукавники Haissky 6,5 дюйма для бега, спортивные нарукавники для iPhone 11 Pro Max Xs Max XR, тренажерный зал, чехол для ...	302 продано	379,84 руб.	//aliexpress.ru/item/4000334256746.html?algo_pvid=1eb8e9b2-9197-47fd-a205-cd04dd20d3d0&algo_expid=1eb8e9b2-9197-47fd-a205-cd04dd20d3d0-42&btsid=0b0a182b16006818218866106e5846&ws_ab_test=searchweb0_0,searchweb201602_,searchweb201603_
4000589802596	Переходник с разъемом типа C на 3,5 мм, разъем для наушников, AUX, аудиоадаптер, кабель для Samsung, Xiaomi, Huawei, P20, OPPO, для телефона, с		154,12 руб.	//aliexpress.ru/item/4000589802596.html?algo_pvid=1eb8e9b2-9197-47fd-a205-cd04dd20d3d0&algo_expid=1eb8e9b2-9197-47fd-a205-cd04dd20d3d0-43&btsid=0b0a182b16006818218866106e5846&ws_ab_test=searchweb0_0,searchweb201602_,searchweb201603_
4001359828139	Oppselve 7,1 внешний usb-звуковой Интерфейс USB Jack 3,5 мм разъем для наушников аудио адаптер Micphone Звуковая карта для Mac Win ПК с системой андроида и Linux		144,78 руб.	//aliexpress.ru/item/4001359828139.html?algo_pvid=1eb8e9b2-9197-47fd-a205-cd04dd20d3d0&algo_expid=1eb8e9b2-9197-47fd-a205-cd04dd20d3d0-44&btsid=0b0a182b16006818218866106e5846&ws_ab_test=searchweb0_0,searchweb201602_,searchweb201603_
4000222458022	1 комплект (11 шт.) Подсветка ic наборы U5650/U5660 катушка L5651/L5661 диод D5650 D5651 конденсатор C5650 C5695 C5651 C5655 для iphone 8 8P		311,35 руб.	//aliexpress.ru/item/4000222458022.html?algo_pvid=1eb8e9b2-9197-47fd-a205-cd04dd20d3d0&algo_expid=1eb8e9b2-9197-47fd-a205-cd04dd20d3d0-45&btsid=0b0a182b16006818218866106e5846&ws_ab_test=searchweb0_0,searchweb201602_,searchweb201603_
4001160325688	Адаптер для подключения Lighting к USB 3, адаптер для iPad iPhone, USB флеш-накопитель, U-диск, устройство для чтения sd-карт, конвертер клавиатуры, OTG кабель	164 продано	388,40 руб.	//aliexpress.ru/item/4001160325688.html?algo_pvid=1eb8e9b2-9197-47fd-a205-cd04dd20d3d0&algo_expid=1eb8e9b2-9197-47fd-a205-cd04dd20d3d0-46&btsid=0b0a182b16006818218866106e5846&ws_ab_test=searchweb0_0,searchweb201602_,searchweb201603_
33054405100	Разъем для наушников USB Type C 3,5 мм, для Samsung Galaxy S8 S9 S10 E Plus, быстрый разъем для наушников, разветвитель, зарядка, аудио адаптер	265 продано	220,28 руб.	//aliexpress.ru/item/33054405100.html?algo_pvid=1eb8e9b2-9197-47fd-a205-cd04dd20d3d0&algo_expid=1eb8e9b2-9197-47fd-a205-cd04dd20d3d0-47&btsid=0b0a182b16006818218866106e5846&ws_ab_test=searchweb0_0,searchweb201602_,searchweb201603_
4000989368770	Новый 3,5 мм стерео HDMI аудио разветвитель аудио Mic & гарнитура переходник для сотового телефона-MG75 Jack штекер Адаптер	18 продано	45,15 - 59,16 руб.	//aliexpress.ru/item/4000989368770.html?algo_pvid=1eb8e9b2-9197-47fd-a205-cd04dd20d3d0&algo_expid=1eb8e9b2-9197-47fd-a205-cd04dd20d3d0-48&btsid=0b0a182b16006818218866106e5846&ws_ab_test=searchweb0_0,searchweb201602_,searchweb201603_
33059710377	Портативный мини внешний аккумулятор 20000 мАч, зеркальный экран, светодиодный дисплей, внешний аккумулятор, блок питания для умного мобильны...	417 продано	917,69 - 950,38 руб.	//aliexpress.ru/item/33059710377.html?algo_pvid=1eb8e9b2-9197-47fd-a205-cd04dd20d3d0&algo_expid=1eb8e9b2-9197-47fd-a205-cd04dd20d3d0-49&btsid=0b0a182b16006818218866106e5846&ws_ab_test=searchweb0_0,searchweb201602_,searchweb201603_
4001041718894	Baseus Qi Беспроводное зарядное устройство для iPhone 11 Pro Xs Max 10 Вт Qi Беспроводное быстрое зарядное устройство видимое зарядное устройство для уни...	109 продано	919,24 - 979,96 руб.	//aliexpress.ru/item/4001041718894.html?algo_pvid=1eb8e9b2-9197-47fd-a205-cd04dd20d3d0&algo_expid=1eb8e9b2-9197-47fd-a205-cd04dd20d3d0-51&btsid=0b0a182b16006818218866106e5846&ws_ab_test=searchweb0_0,searchweb201602_,searchweb201603_
4001359083267	Универсальный спортивный тренажерный зал рычаг для бега мобильный телефон чехол для спорта на открытом воздухе держатель для сотового тел...	3 продано	151,78 руб.	//aliexpress.ru/item/4001359083267.html?algo_pvid=1eb8e9b2-9197-47fd-a205-cd04dd20d3d0&algo_expid=1eb8e9b2-9197-47fd-a205-cd04dd20d3d0-52&btsid=0b0a182b16006818218866106e5846&ws_ab_test=searchweb0_0,searchweb201602_,searchweb201603_
4000083362216	Мужские и женские поясные ремни, сумки для телефона, спортивные сумки для бега, чехол для переноски, ночное видение для iPhone XS Xs max 11 Pro max 8p	83 продано	231,96 - 348,71 руб.	//aliexpress.ru/item/4000083362216.html?algo_pvid=1eb8e9b2-9197-47fd-a205-cd04dd20d3d0&algo_expid=1eb8e9b2-9197-47fd-a205-cd04dd20d3d0-54&btsid=0b0a182b16006818218866106e5846&ws_ab_test=searchweb0_0,searchweb201602_,searchweb201603_
4000592435499	FLOVEME R1 автоматическое зажимное автомобильное беспроводное зарядное устройство 10 Вт быстрое зарядное устройство Инфракрасный Датчик Автом...	928 продано	602,45 - 663,94 руб.	//aliexpress.ru/item/4000592435499.html?algo_pvid=1eb8e9b2-9197-47fd-a205-cd04dd20d3d0&algo_expid=1eb8e9b2-9197-47fd-a205-cd04dd20d3d0-55&btsid=0b0a182b16006818218866106e5846&ws_ab_test=searchweb0_0,searchweb201602_,searchweb201603_
33038096184	Полное покрытие закаленное стекло для Xiaomi Redmi Note 9 8 7 Pro 9S 8T Защита экрана для Redmi 8A 8 7 7A 9 9A защитная пленка	25158 продано	174,36 - 203,93 руб.	//aliexpress.ru/item/33038096184.html?algo_pvid=1eb8e9b2-9197-47fd-a205-cd04dd20d3d0&algo_expid=1eb8e9b2-9197-47fd-a205-cd04dd20d3d0-57&btsid=0b0a182b16006818218866106e5846&ws_ab_test=searchweb0_0,searchweb201602_,searchweb201603_
4001238173603	Адаптер для наушников с разъемом Lighting на 3,5 мм, аудиоразъем Aux, адаптер для iphone, адаптер для наушников		66,17 - 110,53 руб.	//aliexpress.ru/item/4001238173603.html?algo_pvid=1eb8e9b2-9197-47fd-a205-cd04dd20d3d0&algo_expid=1eb8e9b2-9197-47fd-a205-cd04dd20d3d0-58&btsid=0b0a182b16006818218866106e5846&ws_ab_test=searchweb0_0,searchweb201602_,searchweb201603_
4001082780819	Беспроводное зарядное устройство Qi 30 Вт для iPhone 11 Pro X XS 8 Dual 15 Вт, быстрая Беспроводная зарядка для Samsuang Huawei Xiaomi 2.5D, стекло	126 продано	1 812,80 руб.	//aliexpress.ru/item/4001082780819.html?algo_pvid=1eb8e9b2-9197-47fd-a205-cd04dd20d3d0&algo_expid=1eb8e9b2-9197-47fd-a205-cd04dd20d3d0-59&btsid=0b0a182b16006818218866106e5846&ws_ab_test=searchweb0_0,searchweb201602_,searchweb201603_
4001359083267	Универсальный спортивный тренажерный зал рычаг для бега мобильный телефон чехол для спорта на открытом воздухе держатель для сотового тел...	3 продано	151,78 руб.	//aliexpress.ru/item/4001359083267.html?algo_pvid=2c092524-2133-4fdf-8217-5ada4f491f48&algo_expid=2c092524-2133-4fdf-8217-5ada4f491f48-0&btsid=0b0a182b16006818528326826e5846&ws_ab_test=searchweb0_0,searchweb201602_,searchweb201603_
4000083362216	Мужские и женские поясные ремни, сумки для телефона, спортивные сумки для бега, чехол для переноски, ночное видение для iPhone XS Xs max 11 Pro max 8p	83 продано	231,96 - 348,71 руб.	//aliexpress.ru/item/4000083362216.html?algo_pvid=2c092524-2133-4fdf-8217-5ada4f491f48&algo_expid=2c092524-2133-4fdf-8217-5ada4f491f48-2&btsid=0b0a182b16006818528326826e5846&ws_ab_test=searchweb0_0,searchweb201602_,searchweb201603_
33038096184	Полное покрытие закаленное стекло для Xiaomi Redmi Note 9 8 7 Pro 9S 8T Защита экрана для Redmi 8A 8 7 7A 9 9A защитная пленка	25158 продано	174,36 - 203,93 руб.	//aliexpress.ru/item/33038096184.html?algo_pvid=2c092524-2133-4fdf-8217-5ada4f491f48&algo_expid=2c092524-2133-4fdf-8217-5ada4f491f48-4&btsid=0b0a182b16006818528326826e5846&ws_ab_test=searchweb0_0,searchweb201602_,searchweb201603_
4001238173603	Адаптер для наушников с разъемом Lighting на 3,5 мм, аудиоразъем Aux, адаптер для iphone, адаптер для наушников		66,17 - 110,53 руб.	//aliexpress.ru/item/4001238173603.html?algo_pvid=2c092524-2133-4fdf-8217-5ada4f491f48&algo_expid=2c092524-2133-4fdf-8217-5ada4f491f48-5&btsid=0b0a182b16006818528326826e5846&ws_ab_test=searchweb0_0,searchweb201602_,searchweb201603_
4001082780819	Беспроводное зарядное устройство Qi 30 Вт для iPhone 11 Pro X XS 8 Dual 15 Вт, быстрая Беспроводная зарядка для Samsuang Huawei Xiaomi 2.5D, стекло	126 продано	1 812,80 руб.	//aliexpress.ru/item/4001082780819.html?algo_pvid=2c092524-2133-4fdf-8217-5ada4f491f48&algo_expid=2c092524-2133-4fdf-8217-5ada4f491f48-6&btsid=0b0a182b16006818528326826e5846&ws_ab_test=searchweb0_0,searchweb201602_,searchweb201603_
4000956640474	Тонкая защитная пленка из углеродного волокна для Huawei MatePad Pro, Мягкая матовая защитная пленка для экрана без отпечатков пальцев, 10,8 дюйма, за...	184 продано	217,17 - 411,76 руб.	//aliexpress.ru/item/4000956640474.html?algo_pvid=2c092524-2133-4fdf-8217-5ada4f491f48&algo_expid=2c092524-2133-4fdf-8217-5ada4f491f48-7&btsid=0b0a182b16006818528326826e5846&ws_ab_test=searchweb0_0,searchweb201602_,searchweb201603_
4001011353391	20000 мАч 5A супер быстрая зарядка QC3.0 внешний аккумулятор USB C PD3.0 вспышка Быстрая Зарядка Внешний аккумулятор 2USB Powerbank для iPhone Xiaomi	23 продано	1 205,68 - 1 566,84 руб.	//aliexpress.ru/item/4001011353391.html?algo_pvid=2c092524-2133-4fdf-8217-5ada4f491f48&algo_expid=2c092524-2133-4fdf-8217-5ada4f491f48-8&btsid=0b0a182b16006818528326826e5846&ws_ab_test=searchweb0_0,searchweb201602_,searchweb201603_
4000089227497	Сменный держатель для камеры телефона, стеклянная линза для Samsung Galaxy Note 4 N910	14 продано	45,93 - 52,93 руб.	//aliexpress.ru/item/4000089227497.html?algo_pvid=2c092524-2133-4fdf-8217-5ada4f491f48&algo_expid=2c092524-2133-4fdf-8217-5ada4f491f48-9&btsid=0b0a182b16006818528326826e5846&ws_ab_test=searchweb0_0,searchweb201602_,searchweb201603_
4000258464468	Тип C 3,5 мм Aux адаптер кабель-Переходник USB C на 3,5 мм разъем для наушников на обоих концах для подключения внешних устройств к автомагнитоле дл...	543 продано	98,08 - 167,35 руб.	//aliexpress.ru/item/4000258464468.html?algo_pvid=2c092524-2133-4fdf-8217-5ada4f491f48&algo_expid=2c092524-2133-4fdf-8217-5ada4f491f48-10&btsid=0b0a182b16006818528326826e5846&ws_ab_test=searchweb0_0,searchweb201602_,searchweb201603_
33061742114	Liberfeel Maoxin мини внешний аккумулятор 10000 мАч, оригинальный дизайн, милый мультяшный внешний аккумулятор, модный светильник, весовой внешний ак...	381 продано	1 151,19 - 1 304,53 руб.	//aliexpress.ru/item/33061742114.html?algo_pvid=2c092524-2133-4fdf-8217-5ada4f491f48&algo_expid=2c092524-2133-4fdf-8217-5ada4f491f48-13&btsid=0b0a182b16006818528326826e5846&ws_ab_test=searchweb0_0,searchweb201602_,searchweb201603_
4001030571842	Светодиодный кольцевой светильник для селфи 26 см/10 дюймов, светодиодный светильник с регулируемой яркостью, кольцевой светильник с подстав...		1 974,69 - 3 543,86 руб.	//aliexpress.ru/item/4001030571842.html?algo_pvid=2c092524-2133-4fdf-8217-5ada4f491f48&algo_expid=2c092524-2133-4fdf-8217-5ada4f491f48-14&btsid=0b0a182b16006818528326826e5846&ws_ab_test=searchweb0_0,searchweb201602_,searchweb201603_
33002480579	Baseus 10000 мАч PD Быстрая зарядка Power Bank 3A Быстрая зарядка ультра тонкий внешний аккумулятор USB Type C зарядное устройство для iPhone X 8 7 Xiaomi MI	164 продано	1 155,86 - 1 228,25 руб.	//aliexpress.ru/item/33002480579.html?algo_pvid=2c092524-2133-4fdf-8217-5ada4f491f48&algo_expid=2c092524-2133-4fdf-8217-5ada4f491f48-15&btsid=0b0a182b16006818528326826e5846&ws_ab_test=searchweb0_0,searchweb201602_,searchweb201603_
4000709732818	ROMOSS SW30 Pro внешний аккумулятор 26800 мАч портативный внешний аккумулятор 26800 мАч USB внешний аккумулятор зарядное устройство для Xiaomi Mi 9 8 iPhone	225 продано	1 937,33 - 2 489,97 руб.	//aliexpress.ru/item/4000709732818.html?algo_pvid=2c092524-2133-4fdf-8217-5ada4f491f48&algo_expid=2c092524-2133-4fdf-8217-5ada4f491f48-16&btsid=0b0a182b16006818528326826e5846&ws_ab_test=searchweb0_0,searchweb201602_,searchweb201603_
4000794341087	С кабелем инструмент безопасный испытательный прибор быстрая пластина Батарея активация плата Быстрая зарядка Пластина для Samsung для Huawei дл...	5 продано	672,50 руб.	//aliexpress.ru/item/4000794341087.html?algo_pvid=2c092524-2133-4fdf-8217-5ada4f491f48&algo_expid=2c092524-2133-4fdf-8217-5ada4f491f48-17&btsid=0b0a182b16006818528326826e5846&ws_ab_test=searchweb0_0,searchweb201602_,searchweb201603_
4000052821606	Универсальный объектив Ascromy 3 в 1, широкоугольный объектив, камера для мобильного телефона, объектив рыбий глаз, зум, телеобъектив, смартфон д...	205 продано	119,87 руб.	//aliexpress.ru/item/4000052821606.html?algo_pvid=2c092524-2133-4fdf-8217-5ada4f491f48&algo_expid=2c092524-2133-4fdf-8217-5ada4f491f48-18&btsid=0b0a182b16006818528326826e5846&ws_ab_test=searchweb0_0,searchweb201602_,searchweb201603_
32976574992	Qi Беспроводное зарядное устройство, адаптер для зарядки, приемная панель, катушка, приемник для iPhone 5 6 7 XS Max XR X 8 для Samsung S9 S8 S7	137 продано	635,92 - 804,05 руб.	//aliexpress.ru/item/32976574992.html?algo_pvid=2c092524-2133-4fdf-8217-5ada4f491f48&algo_expid=2c092524-2133-4fdf-8217-5ada4f491f48-19&btsid=0b0a182b16006818528326826e5846&ws_ab_test=searchweb0_0,searchweb201602_,searchweb201603_
1005001298930304	KUULAA внешний аккумулятор 20000 мАч Портативная зарядка повербанк мобильный телефон внешний аккумулятор зарядное устройство 20000 мАч для Xiaomi Mi	15 продано	1 166,76 - 1 478,10 руб.	//aliexpress.ru/item/1005001298930304.html?algo_pvid=2c092524-2133-4fdf-8217-5ada4f491f48&algo_expid=2c092524-2133-4fdf-8217-5ada4f491f48-20&btsid=0b0a182b16006818528326826e5846&ws_ab_test=searchweb0_0,searchweb201602_,searchweb201603_
32868077535	Адаптер ROCK Type C к Lightning, переходник Type C к USB 3,1 OTG, переходник Type-c для Lightning к Micro Famale, адаптер для передачи данных OTG	652 продано	229,62 - 267,76 руб.	//aliexpress.ru/item/32868077535.html?algo_pvid=2c092524-2133-4fdf-8217-5ada4f491f48&algo_expid=2c092524-2133-4fdf-8217-5ada4f491f48-21&btsid=0b0a182b16006818528326826e5846&ws_ab_test=searchweb0_0,searchweb201602_,searchweb201603_
4000402287154	Защитное стекло Oneplus 7 / 7T/6T, закаленное 3D стекло с закругленными краями, 9H	206 продано	933,25 - 1 322,43 руб.	//aliexpress.ru/item/4000402287154.html?algo_pvid=2c092524-2133-4fdf-8217-5ada4f491f48&algo_expid=2c092524-2133-4fdf-8217-5ada4f491f48-24&btsid=0b0a182b16006818528326826e5846&ws_ab_test=searchweb0_0,searchweb201602_,searchweb201603_
4000224358000	Универсальная Кнопка возврата BFX, гибкая сборка, Замена для iPhone 7, 7P, 8, 8P, возврат без Touch ID, не требует Bluetooth	254 продано	643,71 руб.	//aliexpress.ru/item/4000224358000.html?algo_pvid=2c092524-2133-4fdf-8217-5ada4f491f48&algo_expid=2c092524-2133-4fdf-8217-5ada4f491f48-25&btsid=0b0a182b16006818528326826e5846&ws_ab_test=searchweb0_0,searchweb201602_,searchweb201603_
4000624453081	Беспроводное зарядное устройство UGREEN Qi, подставка для iPhone 11 Pro, X, XS, 8, XR, Samsung S9, S10, S8, S10E, быстрая Беспроводная зарядная станция	115 продано	1 426,73 - 2 424,58 руб.	//aliexpress.ru/item/4000624453081.html?algo_pvid=2c092524-2133-4fdf-8217-5ada4f491f48&algo_expid=2c092524-2133-4fdf-8217-5ada4f491f48-26&btsid=0b0a182b16006818528326826e5846&ws_ab_test=searchweb0_0,searchweb201602_,searchweb201603_
4000183951058	Портативное зарядное устройство 10000 мАч, Внешнее зарядное устройство 18650 для Xiaomi Mi 9 8 iPhone 11	56 продано	592,33 - 636,70 руб.	//aliexpress.ru/item/4000183951058.html?algo_pvid=2c092524-2133-4fdf-8217-5ada4f491f48&algo_expid=2c092524-2133-4fdf-8217-5ada4f491f48-28&btsid=0b0a182b16006818528326826e5846&ws_ab_test=searchweb0_0,searchweb201602_,searchweb201603_
33019664835	Чехол для телефона, для iphone/Huawei/Samsung/Xiaomi с диагональю 4/4.5/4.7/5/5.5/6 дюймов	10 продано	112,09 - 131,55 руб.	//aliexpress.ru/item/33019664835.html?algo_pvid=2c092524-2133-4fdf-8217-5ada4f491f48&algo_expid=2c092524-2133-4fdf-8217-5ada4f491f48-29&btsid=0b0a182b16006818528326826e5846&ws_ab_test=searchweb0_0,searchweb201602_,searchweb201603_
4001241678116	"Oppselve водонепроницаемый спортивный чехол с повязкой для телефона для iPhone Samsung Huawei 6,5 ""универсальный чехол для телефона с повязкой на руку дер..."	5 продано	275,54 руб.	//aliexpress.ru/item/4001241678116.html?algo_pvid=2c092524-2133-4fdf-8217-5ada4f491f48&algo_expid=2c092524-2133-4fdf-8217-5ada4f491f48-30&btsid=0b0a182b16006818528326826e5846&ws_ab_test=searchweb0_0,searchweb201602_,searchweb201603_
4001321340884	CASEIER 18 Вт 10000 мАч Внешний аккумулятор PD QC 3,0 для iPhone 12 11 XS Pro Max Samsung Xiaomi 10000 мАч портативное зарядное устройство		1 088,93 руб.	//aliexpress.ru/item/4001321340884.html?algo_pvid=2c092524-2133-4fdf-8217-5ada4f491f48&algo_expid=2c092524-2133-4fdf-8217-5ada4f491f48-31&btsid=0b0a182b16006818528326826e5846&ws_ab_test=searchweb0_0,searchweb201602_,searchweb201603_
1005001360904194	60000 мАч Внешний аккумулятор для всех смартфонов мини внешний аккумулятор Pover Bank зарядное устройство с двумя портами Usb внешний аккумулятор ...		579,88 - 1 004,86 руб.	//aliexpress.ru/item/1005001360904194.html?algo_pvid=2c092524-2133-4fdf-8217-5ada4f491f48&algo_expid=2c092524-2133-4fdf-8217-5ada4f491f48-33&btsid=0b0a182b16006818528326826e5846&ws_ab_test=searchweb0_0,searchweb201602_,searchweb201603_
1005001400068671	Внешний аккумулятор высокой емкости 60000 мАч, портативное зарядное устройство 30000 мАч, Внешнее зарядное устройство USB для Xiaomi Mi 9 8 iPhone		648,38 - 962,05 руб.	//aliexpress.ru/item/1005001400068671.html?algo_pvid=2c092524-2133-4fdf-8217-5ada4f491f48&algo_expid=2c092524-2133-4fdf-8217-5ada4f491f48-34&btsid=0b0a182b16006818528326826e5846&ws_ab_test=searchweb0_0,searchweb201602_,searchweb201603_
1005001338100485	Внешний аккумулятор для телефона 90000 мАч USB Type C 50000 мАч Внешний аккумулятор зарядное устройство повербанк для iPhone 11 для Xiaomi		873,32 - 1 504,57 руб.	//aliexpress.ru/item/1005001338100485.html?algo_pvid=2c092524-2133-4fdf-8217-5ada4f491f48&algo_expid=2c092524-2133-4fdf-8217-5ada4f491f48-35&btsid=0b0a182b16006818528326826e5846&ws_ab_test=searchweb0_0,searchweb201602_,searchweb201603_
4000464602922	2 в 1 USB Male К 2x Micro Y сплиттер, кабель для передачи данных, USB 2,0 для смартфонов Android, планшетов, два Micro USB	146 продано	78,62 руб.	//aliexpress.ru/item/4000464602922.html?algo_pvid=2c092524-2133-4fdf-8217-5ada4f491f48&algo_expid=2c092524-2133-4fdf-8217-5ada4f491f48-36&btsid=0b0a182b16006818528326826e5846&ws_ab_test=searchweb0_0,searchweb201602_,searchweb201603_
4001351819475	Оригинальная Беспроводная быстрая подставка для зарядного устройства SAMSUNG EP-N5200 для Galaxy NOTE 20/10/9/8 S8/S9/S10/S20 PLUS для xiaomi 10/9 для iPhone 11	80 продано	990,07 руб.	//aliexpress.ru/item/4001351819475.html?algo_pvid=2c092524-2133-4fdf-8217-5ada4f491f48&algo_expid=2c092524-2133-4fdf-8217-5ada4f491f48-38&btsid=0b0a182b16006818528326826e5846&ws_ab_test=searchweb0_0,searchweb201602_,searchweb201603_
4001195623264	Baseus 2 в 1 Быстрое беспроводное зарядное устройство для Apple Watch 5 4 3 10 Вт Быстрая зарядка для iPhone 11 Airpods Pro	297 продано	1 600,30 руб.	//aliexpress.ru/item/4001195623264.html?algo_pvid=2c092524-2133-4fdf-8217-5ada4f491f48&algo_expid=2c092524-2133-4fdf-8217-5ada4f491f48-39&btsid=0b0a182b16006818528326826e5846&ws_ab_test=searchweb0_0,searchweb201602_,searchweb201603_
32803705864	Внешний аккумулятор ORICO 2600 мАч, 5V1.5A алюминиевый внешний аккумулятор с фонариком SOS, портативный серебристый/золотой/розовый	10 продано	570,54 руб.	//aliexpress.ru/item/32803705864.html?algo_pvid=2c092524-2133-4fdf-8217-5ada4f491f48&algo_expid=2c092524-2133-4fdf-8217-5ada4f491f48-40&btsid=0b0a182b16006818528326826e5846&ws_ab_test=searchweb0_0,searchweb201602_,searchweb201603_
4000161680240	Baseus 15 Вт Двойное беспроводное зарядное устройство для iPhone 11 Pro Max X XS Max XR Видимая беспроводная зарядная панель для Samsung Galaxy Note 10 Plus Note 9 8 S10 S9 Зар...	3032 продано	1 836,15 - 2 147,49 руб.	//aliexpress.ru/item/4000161680240.html?algo_pvid=2c092524-2133-4fdf-8217-5ada4f491f48&algo_expid=2c092524-2133-4fdf-8217-5ada4f491f48-41&btsid=0b0a182b16006818528326826e5846&ws_ab_test=searchweb0_0,searchweb201602_,searchweb201603_
1005001325598838	Оригинальный cubot j9 телефон аккумулятор 4200mah 3,85 V для Cubot J9 смартфон 6,2 дюймов 4200 мА/ч, 13MP тройной Камера Google Android		1 257,05 руб.	//aliexpress.ru/item/1005001325598838.html?algo_pvid=2c092524-2133-4fdf-8217-5ada4f491f48&algo_expid=2c092524-2133-4fdf-8217-5ada4f491f48-42&btsid=0b0a182b16006818528326826e5846&ws_ab_test=searchweb0_0,searchweb201602_,searchweb201603_
33034541656	Кабель для передачи данных YuXi Silver, зарядный кабель, адаптер-конвертер для iPhone/Android, адаптер для Micro USB Type-C к USB 3,0, адаптер для USB-C	1215 продано	79,40 - 117,54 руб.	//aliexpress.ru/item/33034541656.html?algo_pvid=2c092524-2133-4fdf-8217-5ada4f491f48&algo_expid=2c092524-2133-4fdf-8217-5ada4f491f48-43&btsid=0b0a182b16006818528326826e5846&ws_ab_test=searchweb0_0,searchweb201602_,searchweb201603_
